title,author,abstract,url,pages,doi,bibkey,project
Comment on “Groundwater Pumping Is a Significant Unrecognized Contributor to Global Anthropogenic Element Cycles”,"Grant Ferguson, Jennifer C. McIntosh, ","The ideas presented by Stahl (2018) are intriguing. There is a wealth of information that supports that groundwater pumping has perturbed the hydrologic cycle at a global scale (Konikow 2011; Rodell et al. 2018) and perturbations to global elemental cycles would not be unexpected. However, the analysis presented by Stahl (2018) is problematic. Stahl assumes that the 45% of produced waters from oil field operations that were not used in enhanced oil recovery (EOR) are released into the more active portion of the hydrological cycle based on 2007 figures for the United States from Clark and Veil (2009). This figure is substantially lower in reality. Clark and Veil (2009) report that 38.2% of produced waters were injected into nonproducing strata. This injection occurs almost exclusively through Class II disposal wells, which are typically installed in saline aquifers (EPA 2018). Similar practices have been noted in Canada, where there has been a net gain in the amount of water in the Western Canada Sedimentary Basin (Ferguson 2015). In addition, Stahl states that 45% of Shell’s produced water is discharged at the surface based on an estimate from Khatib and Verbeek (2003). However, that study also noted that much of this discharge was to the ocean as part of offshore drilling activities. The overestimation of addition of produced water to the active portion of global elemental cycles will have a notable effect on estimates of fluxes of elements such as Li, Na, Cl, and Ca, which are found in high concentrations",G18-1001,82-82,10.1111/gwat.12840,Ferguson-2018-Comment,Old Meets New: Subsurface Hydrogeological Connectivity and Groundwater Protection
The Persistence of Brines in Sedimentary Basins,"Grant Ferguson, Jennifer C. McIntosh, Stephen E. Grasby, M. Jim Hendry, Scott Jasechko, Matthew B.J. Lindsay, Elco Luijendijk, ","Brines are commonly found at depth in sedimentary basins. Many of these brines are known to be connate waters that have persisted since the early Paleozoic Era. Yet questions remain about their distribution and mechanisms for retention at depth in the Earth's crust. Here we demonstrate that there is insufficient topography to drive these dense fluids from the bottom of deep sedimentary basins. Our assessment based on driving force ratio indicates that sedimentary basins with driving force ratio > 1 contain connate waters and frequently host large evaporite deposits. These stagnant conditions appear to be relatively stable over geological time and insensitive to factors such as glaciations, erosion, compaction, and hydrocarbon generation.",G18-2001,4851-4858,10.1029/2018gl078409,Ferguson-2018-The,Old Meets New: Subsurface Hydrogeological Connectivity and Groundwater Protection
Competition for shrinking window of low salinity groundwater,"Grant Ferguson, Jennifer C. McIntosh, Debra Perrone, Scott Jasechko, ","Groundwater resources are being stressed from the top down and bottom up. Declining water tables and near-surface contamination are driving groundwater users to construct deeper wells in many US aquifer systems. This has been a successful short-term mitigation measure where deep groundwater is fresh and free of contaminants. Nevertheless, vertical salinity profiles are not well-constrained at continental-scales. In many regions, oil and gas activities use pore spaces for energy production and waste disposal. Here we quantify depths that aquifer systems transition from fresh-to-brackish and where oil and gas activities are widespread in sedimentary basins across the United States. Fresh-brackish transitions occur at relatively shallow depths of just a few hundred meters, particularly in eastern US basins. We conclude that fresh groundwater is less abundant in several key US basins than previously thought; therefore drilling deeper wells to access fresh groundwater resources is not feasible extensively across the continent. Our findings illustrate that groundwater stores are being depleted not only by excessive withdrawals, but due to injection, and potentially contamination, from the oil and gas industry in areas of deep fresh and brackish groundwater.",G18-3001,114013,10.1088/1748-9326/aae6d8,Ferguson-2018-Competition,Old Meets New: Subsurface Hydrogeological Connectivity and Groundwater Protection
Salt dissolution and permeability in the Western Canada Sedimentary Basin,"Blake Woroniuk, Kristl Tipton, Stephen E. Grasby, Jennifer C. McIntosh, Grant Ferguson, ","Extensive dissolution of evaporites has occurred in the Williston Basin, Canada, but it is unclear what effect this has had on bulk permeability. The bulk of this dissolution has occurred from the Prairie Evaporite Formation, which is predominantly halite and potash. However, minor evaporite beds and porosity infilling have also been removed from the overlying Dawson Bay and Souris River formations, which are predominantly carbonates. This study examines whether permeability values in the Dawson Bay and Souris River formations have been affected by dissolution, by analyzing 142 drillstem tests from those formations. For both the Dawson Bay and Souris River formations, the highest permeabilities were found in areas where halite dissolution had occurred. However, the mean permeabilities were not statistically different in areas of halite dissolution compared to those containing connate water. Subsequent precipitation of anhydrite is known to have clogged pore spaces and fractures in some instances. Geochemical relationships found here support this idea but there is no statistically significant relationship between anhydrite saturation and permeability. Geomechanical effects, notably closure of fractures due to collapse, could be a mitigating factor. The results indicate that coupling dissolution and precipitation to changes in permeability in regional flow models remains a significant challenge.",G18-4001,161-170,10.1007/s10040-018-1871-6,Woroniuk-2018-Salt,Old Meets New: Subsurface Hydrogeological Connectivity and Groundwater Protection
"Storage, mixing, and fluxes of water in the critical zone across northern environments inferred by stable isotopes of soil water","Matthias Sprenger, Doerthe Tetzlaff, J. M. Buttle, Sean K. Carey, J. P. McNamara, Hjalmar Laudon, Nadine J. Shatilla, Chris Soulsby, ","We thank Audrey Innes for isotope analysis at University of Aberdeen for Bruntland Burn and Krycklan sites, Johannes Tiwari (SLU) for isotope sampling in Krycklan, Pernilla Lofvenius (SLU) for providing PET data for Krycklan (via SITES), and Jeff McDonnell and Kim Janzen (University of Saskatchewan) for soil water isotope analysis for the Dorset and Wolf Creek sites. The Krycklan part was funded by the KAW Branch-Point project. We acknowledge the funding from the European Research Council (ERC, project GA 335910 VeWa). We thank the Editor and three anonymous reviewers for their critical comments during the peer-review process.",G18-5001,1720-1737,10.1002/hyp.13135,"Sprenger-2018-Storage,",Mountain Water Futures
Using stable isotopes to estimate travel times in a data-sparse Arctic catchment: Challenges and possible solutions,"Doerthe Tetzlaff, Thea Ilaria Piovano, Pertti Ala‐aho, Aaron Smith, Sean K. Carey, Philip Marsh, Philip A. Wookey, Lorna E. Street, Chris Soulsby, ","Use of isotopes to quantify the temporal dynamics of the transformation of precipitation into run-off has revealed fundamental new insights into catchment flow paths and mixing processes that influence biogeochemical transport. However, catchments underlain by permafrost have received little attention in isotope-based studies, despite their global importance in terms of rapid environmental change. These high-latitude regions offer limited access for data collection during critical periods (e.g., early phases of snowmelt). Additionally, spatio-temporal variable freeze-thaw cycles, together with the development of an active layer, have a time variant influence on catchment hydrology. All of these characteristics make the application of traditional transit time estimation approaches challenging. We describe an isotope-based study undertaken to provide a preliminary assessment of travel times at Siksik Creek in the western Canadian Arctic. We adopted a model-data fusion approach to estimate the volumes and isotopic characteristics of snowpack and meltwater. Using samples collected in the spring/summer, we characterize the isotopic composition of summer rainfall, melt from snow, soil water, and stream water. In addition, soil moisture dynamics and the temporal evolution of the active layer profile were monitored. First approximations of transit times were estimated for soil and streamwater compositions using lumped convolution integral models and temporally variable inputs including snowmelt, ice thaw, and summer rainfall. Comparing transit time estimates using a variety of inputs revealed that transit time was best estimated using all available inflows (i.e., snowmelt, soil ice thaw, and rainfall). Early spring transit times were short, dominated by snowmelt and soil ice thaw and limited catchment storage when soils are predominantly frozen. However, significant and increasing mixing with water in the active layer during the summer resulted in more damped steam water variation and longer mean travel times (~1.5 years). The study has also highlighted key data needs to better constrain travel time estimates in permafrost catchments.",G18-5002,1936-1952,10.1002/hyp.13146,Tetzlaff-2018-Using,Mountain Water Futures
Spatio-temporal tracer variability in the glacier melt end-member - How does it affect hydrograph separation results?,"Jan Schmieder, Jakob Garvelmann, Thomas Marke, Ulrich Strasser, ","Geochemical and isotopic tracers were often used in mixing models to estimate glacier melt contributions to streamflow, whereas the spatio‐temporal variability in the glacier melt tracer signature and its influence on tracer‐based hydrograph separation results received less attention. We present novel tracer data from a high‐elevation catchment (17 km2, glacierized area: 34%) in the Oetztal Alps (Austria) and investigated the spatial, as well as the subdaily to monthly tracer variability of supraglacial meltwater and the temporal tracer variability of winter baseflow to infer groundwater dynamics. The streamflow tracer variability during winter baseflow conditions was small, and the glacier melt tracer variation was higher, especially at the end of the ablation period. We applied a three‐component mixing model with electrical conductivity and oxygen‐18. Hydrograph separation (groundwater, glacier melt, and rain) was performed for 6 single glacier melt‐induced days (i.e., 6 events) during the ablation period 2016 (July to September). Median fractions (±uncertainty) of groundwater, glacier melt, and rain for the events were estimated at 49±2%, 35±11%, and 16±11%, respectively. Minimum and maximum glacier melt fractions at the subdaily scale ranged between 2±5% and 76±11%, respectively. A sensitivity analysis showed that the intraseasonal glacier melt tracer variability had a marked effect on the estimated glacier melt contribution during events with large glacier melt fractions of streamflow. Intra‐daily and spatial variation of the glacier melt tracer signature played a negligible role in applying the mixing model. The results of this study (a) show the necessity to apply a multiple sampling approach in order to characterize the glacier melt end‐member and (b) reveal the importance of groundwater and rainfall–runoff dynamics in catchments with a glacial flow regime.",G18-2001,1828-1843,10.1002/hyp.11628,Schmieder-2018-Spatio-temporal,Others
Scale Interactions in Turbulence for Mountain Blowing Snow,"Nikolas Aksamit, John W. Pomeroy, ","Abstract Blowing snow particle transport responds to wind motions across many length and time scales. This coupling is nonlinear by nature and complicated in atmospheric flows where eddies of many sizes are superimposed. In mountainous terrain, wind flow descriptions are further complicated by topographically influenced or enhanced flows. To improve the current understanding and modeling of blowing snow transport in complex terrain, statistically significant timing and frequencies of wind–snow coupling were identified in high-frequency observations of surface blowing snow and near-surface turbulence from a mountain field site in the Canadian Rockies. Investigation of the mechanisms influencing near-surface, high-frequency turbulence and snow concentration fluctuations provided strong evidence for amplitude modulation from large-scale motions. The large-scale atmospheric motions modulating near-surface turbulence and snow transport were then compared to specific quadrant analysis structures recently identified as relevant for outdoor blowing snow transport. The results suggest that large atmospheric structures modulate the amplitude of high-frequency turbulence and modify turbulence statistics typically used to model blowing snow. Additionally, blowing snow was preferentially redistributed under the footprint of these same sweep motions, with both low- and high-frequency coherence increasing in their presence.",G18-6001,305-320,10.1175/jhm-d-17-0179.1,Aksamit-2018-Scale,SPADE: Storms and Precipitation Across the Continental Divide Experiment
Global Estimates of River Flow Wave Travel Times and Implications for Low‐Latency Satellite Data,"George H. Allen, Cédric H. David, Konstantinos M. Andreadis, Faisal Hossain, J. S. Famiglietti, ","Earth‐orbiting satellites provide valuable observations of upstream river conditions worldwide. These observations can be used in real‐time applications like early flood warning systems and reservoir operations, provided they are made available to users with sufficient lead time. Yet the temporal requirements for access to satellite‐based river data remain uncharacterized for time‐sensitive applications. Here we present a global approximation of flow wave travel time to assess the utility of existing and future low‐latency/near‐real‐time satellite products, with an emphasis on the forthcoming SWOT satellite mission. We apply a kinematic wave model to a global hydrography data set and find that global flow waves traveling at their maximum speed take a median travel time of 6, 4, and 3 days to reach their basin terminus, the next downstream city, and the next downstream dam, respectively. Our findings suggest that a recently proposed ≤2‐day data latency for a low‐latency SWOT product is potentially useful for real‐time river applications.",G18-7001,7551-7560,10.1029/2018gl077914,Allen-2018-Global,Others
Biological and geophysical feedbacks with fire in the Earth system,"Sally Archibald, Caroline E. R. Lehmann, Claire M. Belcher, William J. Bond, Ross A. Bradstock, Anne-Laure Daniau, Kyle G. Dexter, Elisabeth J. Forrestel, Michelle Greve, Tianhua He, Steven I. Higgins, William A. Hoffmann, Byron B. Lamont, Daniel J. McGlinn, Glenn R. Moncrieff, Colin P. Osborne, Juli G. Pausas, Owen Price, Brad S. Ripley, Brendan M. Rogers, Dylan W. Schwilk, Marcelo Fragomeni Simon, M. R. Turetsky, Guido R. van der Werf, Amy E. Zanne, ","Roughly 3% of the Earth’s land surface burns annually, representing a critical exchange of energy and
matter between the land and atmosphere via combustion. Fires range from slow smouldering peat
fires, to low-intensity surface fires, to intense crown fires, depending on vegetation structure, fuel
moisture, prevailing climate, and weather conditions. While the links between biogeochemistry,
climate and fire are widely studied within Earth system science, these relationships are also mediated
by fuels—namely plants and their litter—that are the product of evolutionary and ecological
processes. Fire is a powerful selective force and, over their evolutionary history, plants have evolved
traits that both tolerate and promote fire numerous times and across diverse clades. Here we outline a
conceptual framework of how plant traits determine the flammability of ecosystems and interact with
climate and weather to influence fire regimes. We explore how these evolutionary and ecological
processes scale to impact biogeochemical and Earth system processes. Finally, we outline several
research challenges that, when resolved, will improve our understanding of the role of plant evolution
in mediating the fire feedbacks driving Earth system processes. Understanding current patterns of fire
and vegetation, as well as patterns of fire over geological time, requires research that incorporates
evolutionary biology, ecology, biogeography, and the biogeosciences.",G18-8001,033003,10.1088/1748-9326/aa9ead,Archibald-2018-Biological,Northern Water Futures
Modeling the exposure of wild fish to endocrine active chemicals: Potential linkages of total estrogenicity to field-observed intersex,"Maricor J. Arlos, Wayne Parker, José R. Bicudo, Pam Law, Keegan A. Hicks, Meghan Fuzzen, Susan A. Andrews, Mark R. Servos, ","Decades of studies on endocrine disruption have suggested the need to manage the release of key estrogens from municipal wastewater treatment plants (WWTP). However, the proposed thresholds are below the detection limits of most routine chemical analysis, thereby restricting the ability of watershed managers to assess the environmental exposure appropriately. In this study, we demonstrated the utility of a mechanistic model to address the data gaps on estrogen exposure. Concentrations of the prominent estrogenic contaminants in wastewaters (estrone, estradiol, and ethinylestradiol) were simulated in the Grand River in southern Ontario (Canada) for nine years, including a period when major WWTP upgrades occurred. The predicted concentrations expressed as total estrogenicity (E2 equivalent concentrations) were contrasted to a key estrogenic response (i.e., intersex) in rainbow darter (Etheostoma caeruleum), a wild sentinel fish species. A predicted total estrogenicity in the river of ≥10 ng/L E2 equivalents was associated with high intersex incidence and severity, whereas concentrations <0.1 ng/L E2 equivalents were associated with minimal intersex expression. Exposure to a predicted river concentration of 0.4 ng/L E2 equivalents, the environmental quality standard (EQS) proposed by the European Union for estradiol, was associated with 34% (95% CI:30-38) intersex incidence and a very low severity score of 0.6 (95% CI:0.5-0.7). This exposure is not predicted to cause adverse effects in rainbow darter. The analyses completed in this study were only based on the predicted presence of three major estrogens (E1, E2, EE2), so caution must be exercised when interpreting the results. Nevertheless, this study illustrates the use of models for exposure assessment, especially when measured data are not available.",G18-9001,187-197,10.1016/j.watres.2018.04.005,Arlos-2018-Modeling,Linking Multiple Stressors to Adverse Ecological Responses Across Watersheds
Multi-year prediction of estrogenicity in municipal wastewater effluents,"Maricor J. Arlos, Wayne Parker, José R. Bicudo, Pam Law, Patricija Marjan, Susan A. Andrews, Mark R. Servos, ","In this study, the estrogenicity of two major wastewater treatment plant (WWTP) effluents located in the central reaches of the Grand River watershed in southern Ontario was estimated using population demographics, excretion rates, and treatment plant-specific removals. Due to the lack of data on estrogen concentrations from direct measurements at WWTPs, the treatment efficiencies through the plants were estimated using the information obtained from an effects-directed analysis. The results show that this approach could effectively estimate the estrogenicity of WWTP effluents, both before and after major infrastructure upgrades were made at the Kitchener WWTP. The model was then applied to several possible future scenarios including population growth and river low flow conditions. The scenario analyses showed that post-upgrade operation of the Kitchener WWTP will not release highly estrogenic effluent under the 2041 projected population increase (36%) or summer low flows. Similarly, the Waterloo WWTP treatment operation is also expected to improve once the upgrades have been fully implemented and is expected to effectively treat estrogens even under extreme scenarios of population growth and river flows. The developed model may be employed to support decision making on wastewater management strategies designed for environmental protection, especially on reducing the endocrine effects in fish exposed to WWTP effluents.",G18-10001,1103-1112,10.1016/j.scitotenv.2017.08.171,Arlos-2018-Multi-year,Linking Multiple Stressors to Adverse Ecological Responses Across Watersheds
A spatial evaluation of global wildfire-water risks to human and natural systems,"François Robinne, Kevin D. Bladon, Carol Miller, Marc‐André Parisien, Jérôme Mathieu, Mike Flannigan, ","The large mediatic coverage of recent massive wildfires across the world has emphasized the vulnerability of freshwater resources. The extensive hydrogeomorphic effects from a wildfire can impair the ability of watersheds to provide safe drinking water to downstream communities and high-quality water to maintain riverine ecosystem health. Safeguarding water use for human activities and ecosystems is required for sustainable development; however, no global assessment of wildfire impacts on water supply is currently available. Here, we provide the first global evaluation of wildfire risks to water security, in the form of a spatially explicit index. We adapted the Driving forces-Pressure-State-Impact-Response risk analysis framework to select a comprehensive set of indicators of fire activity and water availability, which we then aggregated to a single index of wildfire-water risk using a simple additive weighted model. Our results show that water security in many regions of the world is potentially vulnerable, regardless of socio-economic status. However, in developing countries, a critical component of the risk is the lack of socio-economic capability to respond to disasters. Our work highlights the importance of addressing wildfire-induced risks in the development of water security policies; the geographic differences in the components of the overall risk could help adapting those policies to different regional contexts.",G18-10002,1193-1206,10.1016/j.scitotenv.2017.08.112,Robinne-2018-A,Boreal Water Futures: Canada’s Boreal Wildlands-Society-Water Nexus
Historical drought patterns over Canada and their teleconnections with large-scale climate signals,"Zilefac Elvis Asong, H. S. Wheater, Barrie Bonsal, Saman Razavi, Sopan Kurkute, ","Abstract. Drought is a recurring extreme climate event and among the most costly natural disasters in the world. This is particularly true over Canada, where drought is both a frequent and damaging phenomenon with impacts on regional water resources, agriculture, industry, aquatic ecosystems, and health. However, nationwide drought assessments are currently lacking and impacted by limited ground-based observations. This study provides a comprehensive analysis of historical droughts over the whole of Canada, including the role of large-scale teleconnections. Drought events are characterized by the Standardized Precipitation Evapotranspiration Index (SPEI) over various temporal scales (1, 3, 6, and 12 consecutive months, 6 months from April to September, and 12 months from October to September) applied to different gridded monthly data sets for the period 1950–2013. The Mann–Kendall test, rotated empirical orthogonal function, continuous wavelet transform, and wavelet coherence analyses are used, respectively, to investigate the trend, spatio-temporal patterns, periodicity, and teleconnectivity of drought events. Results indicate that southern (northern) parts of the country experienced significant trends towards drier (wetter) conditions although substantial variability exists. Two spatially well-defined regions with different temporal evolution of droughts were identified – the Canadian Prairies and northern central Canada. The analyses also revealed the presence of a dominant periodicity of between 8 and 32 months in the Prairie region and between 8 and 40 months in the northern central region. These cycles of low-frequency variability are found to be associated principally with the Pacific–North American (PNA) and Multivariate El Niño/Southern Oscillation Index (MEI) relative to other considered large-scale climate indices. This study is the first of its kind to identify dominant periodicities in drought variability over the whole of Canada in terms of when the drought events occur, their duration, and how often they occur.",G18-11001,3105-3124,10.5194/hess-22-3105-2018,Asong-2018-Historical,Integrated Modelling Program for Canada (IMPC)
