title,author,abstract,url,pages,doi,bibkey,project
Historical drought patterns over Canada and their relation to teleconnections,"Zilefac Elvis Asong, H. S. Wheater, Barrie Bonsal, Saman Razavi, Sopan Kurkute, ","Abstract. Drought is a recurring extreme climate event and among the most costly natural disasters in the world. This is particularly true over Canada, where drought is both a frequent and damaging phenomenon with impacts on regional water resources, agriculture, industry, aquatic ecosystems and health. However, nation-wide drought assessments are currently lacking and impacted by limited ground-based observations. This study provides a comprehensive analysis of historical droughts over the whole of Canada, including the role of large-scale teleconnections. Drought events are characterized by the Standardized Precipitation-Evapotranspiration Index (SPEI) over various temporal scales (1, 3, 6, and 12 consecutive months, 6 months from April to September, and 12 months from October to September) applied to different gridded monthly data sets for the period 1950–2013. The Mann Kendall test, Rotated Empirical Orthogonal Function, Continuous Wavelet Transform, and Wavelet Coherence analyses are used, respectively, to investigate the trend, spatiotemporal patterns, periodicity, and teleconnectivity of drought events. Results indicate that southern (northern) parts of the country experienced significant trends towards drier (wetter) conditions although substantial variability exists. Two spatially well-defined regions with different temporal evolution of droughts were identified―the Canadian Prairies and Northern-central Canada. The analyses also revealed the presence of a dominant periodicity of between 8–32 months in the Prairie region, and 8–40 months in the Northern central region. These cycles of low-frequency variability are found to be associated principally to the Pacific-North American (PNA) and Multivariate El Niño/Southern Oscillation Index (MEI) relative to other considered large-scale climate indices. This study is the first of its kind to identify dominant periodicities in drought variability over the whole of Canada in terms of when the drought events occur, the duration, and how often they do so.",G18-32005,,10.5194/hess-2018-122,Asong-Wheater-2018-Historical-drought,Core Modelling & Forecasting Team
"The Cariboo Alpine Mesonet: Sub-hourly hydrometeorological 
observations of  British Columbia's Cariboo Mountains and 
surrounding area since 2006","Marco A. Hernández-Henríquez, Aseem R. Sharma, Mark P. Taylor, Hadleigh D. Thompson, Stephen J. Déry, ","Abstract. This article presents the development of a sub-hourly database of hydrometeorological conditions collected in British Columbia's Cariboo Mountains and surrounding area extending from 2006 to present. The Cariboo Alpine Mesonet (CAMnet) forms a network of 11 active hydrometeorological stations positioned at strategic locations across mid- to high elevations of the Cariboo Mountains. This mountain range spans 44,150 km2 forming the northern extension of the Columbia Mountains. Deep fjord lakes along with old-growth redcedar and hemlock forests reside in the lower valleys, montane forests of Engelmann spruce, lodgepole pine and subalpine fir permeate the mid-elevations while alpine tundra, glaciers and several large icefields cover the higher elevations. The automatic weather stations typically measure air and soil temperature, relative humidity, atmospheric pressure, wind speed and direction, rainfall, and snow depth at 15 minute intervals. Additional measurements at some stations include shortwave and longwave radiation, near-surface air, skin, snow or water temperature, and soil moisture among others. Details on deployment sites, the instrumentation used and its precision, the collection and quality control process are provided. Instructions on how to access the database at Zenodo, an online public data repository, are also furnished (https://doi.org/10.5281/zenodo.1195043). Information on some of the challenges and opportunities encountered in maintaining continuous and homogeneous time series of hydrometeorological variables and remote field sites is provided. The paper also summarizes ongoing plans to expand CAMnet to better monitor atmospheric conditions in BC's mountainous terrain, efforts to push data online in (near)real-time, availability of ancillary data, and lessons learned thus far in developing this mesoscale network of hydrometeorological stations in the data-sparse Cariboo Mountains.",G18-32006,,10.5194/essd-2018-45,Hernández-Henríquez-Sharma-2018-The-Cariboo,Mountain Water Futures
The Influence of Shallow Taliks on Permafrost Thaw and Active Layer Dynamics in Subarctic Canada,"Ryan F. Connon, Élise Devoie, Masaki Hayashi, Tyler Veness, William L. Quinton, ","Measurements of active layer thickness (ALT) are typically taken at the end of summer, a time synonymous with maximum thaw depth. By definition, the active layer is the layer above permafrost that freezes and thaws annually. This study, conducted in peatlands of subarctic Canada, in the zone of thawing discontinuous permafrost, demonstrates that the entire thickness of ground atop permafrost does not always refreeze over winter. In these instances, a talik exists between the permafrost and active layer, and ALT must therefore be measured by the depth of refreeze at the end of winter. As talik thickness increases at the expense of the underlying permafrost, ALT is shown to simultaneously decrease. This suggests that the active layer has a maximum thickness that is controlled by the amount of energy lost from the ground to the atmosphere during winter. The taliks documented in this study are relatively thin (<2 m) and exist on forested peat plateaus. The presence of taliks greatly affects the stability of the underlying permafrost. Vertical permafrost thaw was found to be significantly greater in areas with taliks (0.07 m year−1) than without (0.01 m year−1). Furthermore, the spatial distribution of areas with taliks increased between 2011 and 2015 from 20% to 48%, a phenomenon likely caused by an anomalously large ground heat flux input in 2012. Rapid talik development and accelerated permafrost thaw indicates that permafrost loss may exhibit a nonlinear response to warming temperatures. Documentation of refreeze depths and talik development is needed across the circumpolar north.",G18-33001,281-297,10.1002/2017jf004469,Connon-2018-The,Core Technical Team
Challenges in Modeling Turbulent Heat Fluxes to Snowpacks in Forest Clearings,"Jonathan Conway, John W. Pomeroy, Warren Helgason, Nicholas Kinar, ","Abstract Forest clearings are common features of evergreen forests and produce snowpack accumulation and melt differing from that in adjacent forests and open terrain. This study has investigated the challenges in specifying the turbulent fluxes of sensible and latent heat to snowpacks in forest clearings. The snowpack in two forest clearings in the Canadian Rockies was simulated using a one-dimensional (1D) snowpack model. A trade-off was found between optimizing against measured snow surface temperature or snowmelt when choosing how to specify the turbulent fluxes. Schemes using the Monin–Obukhov similarity theory tended to produce negatively biased surface temperature, while schemes that enhanced turbulent fluxes, to reduce the surface temperature bias, resulted in too much melt. Uncertainty estimates from Monte Carlo experiments showed that no realistic parameter set could successfully remove biases in both surface temperature and melt. A simple scheme that excludes atmospheric stability correction was required to successfully simulate surface temperature under low wind speed conditions. Nonturbulent advective fluxes and/or nonlocal sources of turbulence are thought to account for the maintenance of heat exchange in low-wind conditions. The simulation of snowmelt was improved by allowing enhanced latent heat fluxes during low-wind conditions. Caution is warranted when snowpack models are optimized on surface temperature, as model tuning may compensate for deficiencies in conceptual and numerical models of radiative, conductive, and turbulent heat exchange at the snow surface and within the snowpack. Such model tuning could have large impacts on the melt rate and timing of the snow-free transition in simulations of forest clearings within hydrological and meteorological models.",G18-34001,1599-1616,10.1175/jhm-d-18-0050.1,Conway-2018-Challenges,Boreal Water Futures: Canada’s Boreal Wildlands-Society-Water Nexus
Simulation of Past Changes in the Austrian Snow Cover 1948–2009,"Thomas Marke, Florian Hanzer, Marc Olefs, Ulrich Strasser, ","Abstract A distributed snow model is applied to simulate the spatiotemporal evolution of the Austrian snow cover at 1 km × 1 km spatial and daily temporal resolution for the period 1948–2009. After a comprehensive model validation, changes in snow cover conditions are analyzed for all of Austria as well as for different Austrian subregions and elevation belts focusing on the change in snow cover days (SCDs). The comparison of SCDs for the period 1950–79 to those achieved for 1980–2009 for all of Austria shows a decrease in SCDs with a maximum of >35 SCDs near Villach (Carinthia). The analysis of SCD changes in different subregions of Austria reveals mean changes between −11 and −15 days with highest absolute change in SCDs for southern Austria. Two decrease maxima could be identified in elevations of 500–2000 m MSL (between −13 and −18 SCDs depending on the subregion considered) and above 2500 m MSL (over −20 SCDs in the case of central Austria). The temporal distribution of SCD change in the Austrian subregions is characterized by a reduction of SCDs in midwinter and at the end of winter rather than by fewer SCDs in early winter. With respect to the temporal distribution of SCD change in different elevation belts, changes in elevations below 1000 m MSL are characterized by a distinct reduction of SCDs in January. With increasing elevation the maximum change in SCDs shifts toward the summer season, reaching a maximum decrease in the months of June–August above 2500 m MSL.",G18-4001,1529-1545,10.1175/jhm-d-17-0245.1,Marke-2018-Simulation,Others
A numerical model for the simulation of snowpack solute dynamics to capture runoff ionic pulses during snowmelt: The PULSE model,"Diogo Costa, John W. Pomeroy, H. S. Wheater, ","Abstract Early ionic pulse during spring snowmelt can account for a significant portion of the total annual nutrient load in seasonally snow-covered areas. Ionic pulses are a consequence of snow grain core to surface ion segregation during metamorphism, a process commonly referred to as ion exclusion. While numerous studies have provided quantitative measurements of this phenomenon, very few process-based mathematical models have been proposed for diagnostic and prognostic investigations. A few early modelling attempts have been successful in capturing this process assuming transport through porous media with variable porosity. However, this process is represented in models in ways that misalign with the mechanistic view of the process described in the literature. In this research, a process-based model is proposed that can simulated ionic pulses in runoff by emulating solute leaching from snow grains during melt and the subsequent vertical solute transport by meltwater through the snowpack. To facilitate its use without the need for snow-physics’ models, simplified alternative methods are proposed to estimate some of the variables required by the model. The model was applied to two regions, and a total of 4 study sites, that are subject to significantly different winter climatic and hydrological conditions. Comparison between observations and simulation results suggest that the model can capture well the overall snow melt runoff concentration pattern, including both the timing and magnitude of the early melt ionic pulse. The model enables the prediction of concentration profiles of the dry (snow) and liquid (wet) fractions within the snow matrix for the first time. Although there is a computational cost associated with the proposed modelling framework, this study demonstrates that it can provide more detailed information about the reallocation and transport of ions through snowpacks, which can ultimately be used to improve nutrient transport predictions during snowmelt.",G18-35001,37-48,10.1016/j.advwatres.2018.09.008,Costa-2018-A,Integrated Modelling Program for Canada (IMPC)
Examining controls on peak annual streamflow and floods  in the Fraser River Basin of British Columbia,"Charles L. Curry, Francis W. Zwiers, ","Abstract. The Fraser River Basin (FRB) of British Columbia is one of the largest and most important watersheds in western North America, and home to a rich diversity of biological species and economic assets that depend implicitly upon its extensive riverine habitats. The hydrology of the FRB is dominated by snow accumulation and melt processes, leading to a prominent annual peak streamflow invariably occurring in May–July. Nevertheless, while annual peak daily streamflow (APF) during the spring freshet in the FRB is historically well correlated with basin-averaged, 1 April snow water equivalent (SWE), there are numerous occurrences of anomalously large APF in below- or near-normal SWE years, some of which have resulted in damaging floods in the region. An imperfect understanding of which other climatic factors contribute to these anomalously large APFs hinders robust projections of their magnitude and frequency. We employ the Variable Infiltration Capacity (VIC) process-based hydrological model driven by gridded observations to investigate the key controlling factors of anomalous APF events in the FRB and four of its subbasins that contribute nearly 70 % of the annual flow at Fraser-Hope. The relative influence of a set of predictors characterizing the interannual variability of rainfall, snowfall, snowpack (characterized by the annual maximum value, SWEmax), soil moisture and temperature on simulated APF at Hope (the main outlet of the FRB) and at the subbasin outlets is examined within a regression framework. The influence of large-scale climate modes of variability (the Pacific Decadal Oscillation (PDO) and the El Niño–Southern Oscillation – ENSO) on APF magnitude is also assessed, and placed in context with these more localized controls. The results indicate that next to SWEmax (univariate Spearman correlation with APF of ρ^ = 0.64; 0.70 (observations; VIC simulation)), the snowmelt rate (ρ^ = 0.43 in VIC), the ENSO and PDO indices (ρ^ = −0.40; −0.41) and (ρ^ = −0.35; −0.38), respectively, and rate of warming subsequent to the date of SWEmax (ρ^ = 0.26; 0.38), are the most influential predictors of APF magnitude in the FRB and its subbasins. The identification of these controls on annual peak flows in the region may be of use in understanding seasonal predictions or future projected streamflow changes.",G18-36001,2285-2309,10.5194/hess-22-2285-2018,Curry-2018-Examining,Climate-Related Precipitation Extremes
Sustainable Ice-Jam Flood Management for Socio-Economic and Socio-Ecological Systems,"Apurba Das, Maureen G. Reed, Karl–Erich Lindenschmidt, ","Ice jams are critical components of the hydraulic regimes of rivers in cold regions. In addition to contributing to the maintenance of wetland ecology, including aquatic animals and waterfowl, ice jams provide essential moisture and nutrient replenishment to perched lakes and ponds in northern inland deltas. However, river ice-jam flooding can have detrimental impacts on in-stream aquatic ecosystems, cause damage to property and infrastructure, and present hazards to riverside communities. In order to maintain sustainable communities and ecosystems, ice-jam flooding must be both mitigated and promoted. This study reviews various flood management strategies used worldwide, and points to the knowledge gaps in these strategies. The main objective of the paper is to provide a framework for a sustainable ice-jam flood management strategy in order to better protect riverine socio-economic and socio-ecological systems. Sustainable flood management must be a carefully adopted and integrated strategy that includes both economic and ecological perspectives in order to mitigate ice-jam flooding in riverside socio-economic systems, while at the same time promoting ice-jam flooding of riverine socio-ecological systems such as inland deltas.",G18-37001,135,10.3390/w10020135,Das-2018-Sustainable,Integrated Modelling Program for Canada (IMPC)
Current inventory approach overestimates the effect of irrigated crop management on soil-derived greenhouse gas emissions in the semi-arid Canadian Prairies,"Cody Lee David, R. Lemke, Warren Helgason, Richard E. Farrell, ","Abstract Greenhouse gas (GHG) emissions from agricultural soils in the Canadian Prairie region are generally low and, due to dry, well aerated soil conditions, can be quite variable. Compared to dryland (rainfed) crop production, irrigated cropping has potential to contribute greater quantities of soil derived nitrous oxide (N2O), carbon dioxide (CO2), and methane (CH4) to the atmosphere as producers target higher yields by minimizing soil moisture limitations and applying greater amounts of nitrogen fertilizers. However, the actual GHG dynamics from irrigated soils in this region are not well understood as there have been few field-based studies in the semi-arid prairies of western Canada. The goal of this study was to identify how emissions of soil derived N2O, CO2, and CH4 are influenced by changes in soil temperature, water status, and nitrogen rates brought about by irrigated crop management. This was achieved through continuous, in-situ monitoring of soil conditions and chamber-based measurements of soil GHG flux. The most notable change in soil conditions brought about by irrigation was elevated moisture levels, which appeared to influence the flux dynamics of all three agricultural greenhouse gases—specifically, a reduction in CH4 uptake and periodic increases in CO2 and N2O emissions. Despite the reduced soil moisture limitation, annual N2O emissions from the irrigated cropping system were much lower than those calculated using the current Canadian National GHG Inventory Reporting. This suggests that annual emissions are limited more by N availability rather than moisture deficits, as the current method for emissions accounting assumes. Consequently, our results indicate that emissions from irrigated cropping systems in the semi-arid Canadian Prairies are overestimated by the current inventory approach. Moreover, because irrigated crop production involves more than just the application of water, our results demonstrate that a more systems-oriented approach to GHG accounting is required to capture the combined effects of water-soil-crop management on GHG emissions from irrigated cropping systems.",G18-38001,19-32,10.1016/j.agwat.2018.06.006,David-2018-Current,Agricultural Water Futures
Potential influence of nutrient availability along a hillslope: Peatland gradient on aspen recovery following fire,"Midori Depante, Richard M. Petrone, K. J. Devito, Nicholas Kettridge, Merrin L. Macrae, Carl Mendoza, J. M. Waddington, ","The Boreal Plains (BP) of Western Canada have been exposed to increasing disturbance by wildfire and host a mixture of upland‐wetland‐pond complexes with substantial quantities of trembling aspen (Populus tremuloides Michx.) throughout the terrestrial areas. The ability of these tree species to regenerate within both upland and wetland areas of the BP following wildfire is unclear. The purpose of this study was to investigate the influence of fire on nutrient dynamics in soil and water in peatlands and forested landscapes in the BP and relate this to aspen regeneration. Nutrient concentrations, nutrient supply rates, and net nutrient mineralization rates were determined in burned and unburned sections of a peatland and forest and compared with the regeneration of aspen. NO3−, NH4+, and P varied spatially throughout the landscape, and differences were observed between peatland and upland areas. In general, differences in nutrient dynamics were not observed between burned and unburned areas, with the exception of P. Nutrient and growth data suggest that aspen do not require nutrient‐rich conditions for regeneration and instead relied on forest litter to satisfy nutrient demands. Although the peatlands contained high nutrients, aspen did not flourish in the combination of anoxic and aerobic organic‐rich soils present in this area. Although aspen may use peat water and nutrients through their rooting zones, peatlands are unsuitable for aspen re‐establishment in the long‐term. However, the combination of abundant nutrients in surface mineral soils in peat margins may indicate the vulnerability of margins to upland transformations in later successional stages.",G18-39001,e1955,10.1002/eco.1955,Depante-2018-Potential,Boreal Water Futures: Canada’s Boreal Wildlands-Society-Water Nexus
Minor contribution of overstorey transpiration to landscape evapotranspiration in boreal permafrost peatlands,"Rebecca K. Warren, Christoforos Pappas, Manuel Helbig, L. Chasmer, Aaron Berg, Jennifer L. Baltzer, William L. Quinton, Oliver Sonnentag, ","Evapotranspiration (ET) is a key component of the water cycle, whereby accurate partitioning of ET into evaporation and transpiration provides important information about the intrinsically coupled carbon, water, and energy fluxes. Currently, global estimates of partitioned evaporative and transpiration fluxes remain highly uncertain, especially for high‐latitude ecosystems where measurements are scarce. Forested peat plateaus underlain by permafrost and surrounded by permafrost‐free wetlands characterize approximately 60% (7.0 × 107 km2) of Canadian peatlands. In this study, 22 Picea mariana (black spruce) individuals, the most common tree species of the North American boreal forest, were instrumented with sap flow sensors within the footprint of an eddy covariance tower measuring ET from a forest–wetland mosaic landscape. Sap flux density (JS), together with remote sensing data and in situ measurements of canopy structure, was used to upscale tree‐level JS to overstorey transpiration (TBS). Black spruce trees growing in nutrient‐poor permafrost peat soils were found to have lower mean JS than those growing in mineral soils. Overall, TBS contributed less than 1% to landscape ET. Climate‐change‐induced forest loss and the expansion of wetlands may further minimize the contributions of TBS to ET and increase the contribution of standing water.",G18-39002,e1975,10.1002/eco.1975,Warren-2018-Minor,Northern Water Futures
Missing pieces to modeling the Arctic-Boreal puzzle,"Joshua B. Fisher, D. J. Hayes, Christopher R. Schwalm, D. N. Huntzinger, Eric Stofferahn, Kevin Schaefer, Yiqi Luo, Stan D. Wullschleger, Scott J. Goetz, Charles E. Miller, P. C. Griffith, Sarah Chadburn, Abhishek Chatterjee, Philippe Ciais, Thomas A. Douglas, Hélène Genet, Akihiko Ito, C. S. R. Neigh, Benjamin Poulter, Brendan M. Rogers, Oliver Sonnentag, Hanqin Tian, Weile Wang, Yongkang Xue, Zong‐Liang Yang, Ning Zeng, Zhen Zhang, ","Author(s): Fisher, JB; Hayes, DJ; Schwalm, CR; Huntzinger, DN; Stofferahn, E; Schaefer, K; Luo, Y; Wullschleger, SD; Goetz, S; Miller, CE; Griffith, P; Chadburn, S; Chatterjee, A; Ciais, P; Douglas, TA; Genet, H; Ito, A; Neigh, CSR; Poulter, B; Rogers, BM; Sonnentag, O; Tian, H; Wang, W; Xue, Y; Yang, ZL; Zeng, N; Zhang, Z | Abstract: NASA has launched the decade-long Arctic-Boreal Vulnerability Experiment (ABoVE). While the initial phases focus on field and airborne data collection, early integration with modeling activities is important to benefit future modeling syntheses. We compiled feedback from ecosystem modeling teams on key data needs, which encompass carbon biogeochemistry, vegetation, permafrost, hydrology, and disturbance dynamics. A suite of variables was identified as part of this activity with a critical requirement that they are collected concurrently and representatively over space and time. Individual projects in ABoVE may not capture all these needs, and thus there is both demand and opportunity for the augmentation of field observations, and synthesis of the observations that are collected, to ensure that science questions and integrated modeling activities are successfully implemented.",G18-40001,020202,10.1088/1748-9326/aa9d9a,Fisher-2018-Missing,Northern Water Futures
