title,author,abstract,url,pages,doi,bibkey,project
"Design of a human biomonitoring community-based project in the Northwest Territories Mackenzie Valley, Canada, to investigate the links between nutrition, contaminants and country foods","Mylène Ratelle, Matthew Laird, Shannon E. Majowicz, Kelly Skinner, Heidi K. Swanson, Brian Laird, ","Community-based projects place emphasis on a collaborative approach and facilitate research among Indigenous populations regarding local issues and challenges, such as traditional foods consumption, climate change and health safety. Country foods (locally harvested fish, game birds, land animals and plants), which contribute to improved food security, can also be a primary route of contaminant exposure among populations in remote regions. A community-based project was launched in the Dehcho and Sahtù regions of the Northwest Territories (Canada) to: 1) assess contaminants exposure and nutrition status; 2) investigate the role of country food on nutrient and contaminant levels and 3) understand the determinants of message perception on this issue. Consultation with community members, leadership, local partners and researchers was essential to refine the design of the project and implement it in a culturally relevant way. This article details the design of a community-based biomonitoring study that investigates country food use, contaminant exposure and nutritional status in Canadian subarctic First Nations in the Dehcho and Sahtù regions. Results will support environmental health policies in the future for these communities. The project was designed to explore the risks and benefits of country foods and to inform the development of public health strategies.",G18-105001,1510714,10.1080/22423982.2018.1510714,Ratelle-2018-Design,Northern Water Futures
"Cadmium exposure in First Nations communities of the Northwest Territories, Canada: smoking is a greater contributor than consumption of cadmium-accumulating organ meats","Mylène Ratelle, Xinci Li, Brian Laird, ",Study of cadmium exposure sources in First Nations communities promotes traditional food consumption and supports the prioritization of environmental issues.,G18-106001,1441-1453,10.1039/c8em00232k,Ratelle-2018-Cadmium,Northern Water Futures
"Implementation of human biomonitoring in the Dehcho region of the Northwest Territories, Canada (2016–2017)","Mylène Ratelle, Kelly Skinner, Matthew Laird, Shannon E. Majowicz, Danielle Brandow, Sara Packull-McCormick, Michèle Bouchard, Denis Dieme, Ken D. Stark, Juan J. Aristizabal Henao, Rhona M. Hanning, Brian Laird, ","Human biomonitoring represents an important tool for health risk assessment, supporting the characterization of contaminant exposure and nutrient status. In communities where country foods (locally harvested foods: land animals, fish, birds, plants) are integrated in the daily diet, as is the case in remote northern regions where food security is a challenge, such foods can potentially be a significant route of contaminant exposure. To assess this issue, a biomonitoring project was implemented among Dene/Métis communities of the Dehcho region of the Northwest Territories, Canada.Participants completed dietary surveys (i.e., a food frequency questionnaire and 24-h recall) to estimate food consumption patterns as well as a Health Messages Survey to evaluate the awareness and perception of contaminants and consumption notices. Biological sampling of hair, urine and blood was conducted. Toxic metals (e.g., mercury, lead, cadmium), essential metals (e.g., copper, nickel, zinc), fatty acids, and persistent organic pollutants (POPs) were measured in samples.The levels of contaminants in blood, hair and urine for the majority of participants were below the available guidance values for mercury, cadmium, lead and uranium. However, from the 279 participants, approximately 2% were invited to provide follow up samples, mainly for elevated mercury level. Also, at the population level, blood lead (GM: 11 μg/L) and blood cadmium (GM: 0.53 μg/L) were slightly above the Canadian Health Measures Survey data. Therefore, although country foods occasionally contain elevated levels of particular contaminants, human exposures to these metals remained similar to those seen in the Canadian general population. In addition, dietary data showed the importance and diversity of country foods across participating communities, with the consumption of an average of 5.1% of total calories from wild-harvested country foods.This project completed in the Mackenzie Valley of the Northwest Territories fills a data gap across other biomonitoring studies in Canada as it integrates community results, will support stakeholders in the development of public health strategies, and will inform environmental health issue prioritization.",G18-107001,,10.1186/s13690-018-0318-9,Ratelle-2018-Implementation,Northern Water Futures
Prewhitening of hydroclimatic time series? Implications for inferred change and variability across time scales,"Saman Razavi, Richard M. Vogel, ","Abstract Prewhitening, the process of eliminating or reducing short-term stochastic persistence to enable detection of deterministic change, has been extensively applied to time series analysis of a range of geophysical variables. Despite the controversy around its utility, methodologies for prewhitening time series continue to be a critical feature of a variety of analyses including: trend detection of hydroclimatic variables and reconstruction of climate and/or hydrology through proxy records such as tree rings. With a focus on the latter, this paper presents a generalized approach to exploring the impact of a wide range of stochastic structures of short- and long-term persistence on the variability of hydroclimatic time series. Through this approach, we examine the impact of prewhitening on the inferred variability of time series across time scales. We document how a focus on prewhitened, residual time series can be misleading, as it can drastically distort (or remove) the structure of variability across time scales. Through examples with actual data, we show how such loss of information in prewhitened time series of tree rings (so-called “residual chronologies”) can lead to the underestimation of extreme conditions in climate and hydrology, particularly droughts, reconstructed for centuries preceding the historical period.",G18-108001,109-115,10.1016/j.jhydrol.2017.11.053,Razavi-2018-Prewhitening,Integrated Modelling Program for Canada (IMPC)
Inconsequential effects of flooding in 2014 on lakes in the Peace‐Athabasca Delta (Canada) due to long‐term drying,"Casey R. Remmer, Wynona H. Klemt, Brent B. Wolfe, Roland I. Hall, ","Climate‐driven decline in freshwater supplied by rivers draining the hydrographic apex of western North America has ramifications for downstream ecosystems and society. For the Peace‐Athabasca Delta (PAD), floods from the Peace and Athabasca rivers are critical for sustaining abundant shallow water habitat, but their frequency has been in decline for decades over much of its area. Here, we assess current hydrological and limnological status in the PAD by integrating spatial and temporal data. Analysis of water isotope compositions and water chemistry measured at numerous lakes across the delta shows that hydro‐limnological effects of the large‐scale ice‐jam flood event of 2014 failed to persist beyond the early ice‐free season of 2015. Isotope‐inferred paleohydrological records from five hydrologically representative lakes in the PAD indicate that periodic desiccation during the Little Ice Age occurred at the most elevated basin in response to locally arid climatic conditions, yet other lower elevation sites were influenced by high water level on Lake Athabasca owing to increased snowmelt‐ and glacier‐derived river discharge. In contrast, water isotope data during the past 15 yr at all five lakes consistently document the strong role of evaporation, a trend which began in the early to mid‐20th century according to sediment records and is indicative of widespread aridity unprecedented during the past 400 yr. We suggest that integration of hydrological and limnological approaches over space and time is needed to inform assessment of contemporary lake conditions in large, complex floodplain landscapes.",G18-109001,1502-1518,10.1002/lno.10787,Remmer-2018-Inconsequential,Northern Water Futures
Emerging trends in global freshwater availability,"Matthew Rodell, J. S. Famiglietti, D. N. Wiese, J. T. Reager, H. K. Beaudoing, F. W. Landerer, Min‐Hui Lo, ","Freshwater availability is changing worldwide. Here we quantify 34 trends in terrestrial water storage observed by the Gravity Recovery and Climate Experiment (GRACE) satellites during 2002-2016 and categorize their drivers as natural interannual variability, unsustainable groundwater consumption, climate change or combinations thereof. Several of these trends had been lacking thorough investigation and attribution, including massive changes in northwestern China and the Okavango Delta. Others are consistent with climate model predictions. This observation-based assessment of how the world's water landscape is responding to human impacts and climate variations provides a blueprint for evaluating and predicting emerging threats to water and food security.",G18-110001,651-659,10.1038/s41586-018-0123-1,Rodell-2018-Emerging,Core Modelling & Forecasting Team
Ice-jam flood research: a scoping review,"Prabin Rokaya, Sujata Budhathoki, Karl–Erich Lindenschmidt, ","Almost 60% of the rivers in the northern hemisphere experience significant seasonal effects of river ice. In many of these northern rivers, ice-jam floods (IJFs) pose serious threats to riverine communities. Since the inundation elevations associated with ice-jam events can be several meters higher than open-water floods for the same or even lower discharges, IJFs can be more disastrous to local communities and economies, especially as their occurrence is often very sudden and difficult to anticipate. In the last several decades, there have been many important advances in river ice hydrology, resulting in improved knowledge and capacity to deal with IJFs. This paper presents a review of IJF literature available on the Web of Science. Nature and scope of scholarly research on IJF are analysed, and an agenda for research that better integrates IJF challenges with research and mitigation opportunities is suggested.",G18-111001,1439-1457,10.1007/s11069-018-3455-0,Rokaya-2018-Ice-jam,Integrated Modelling Program for Canada (IMPC)
Capturing agricultural soil freeze/thaw state through remote sensing and ground observations: A soil freeze/thaw validation campaign,"Tracy Rowlandson, Aaron Berg, Alex Roy, Edward Kim, Renato Pardo Lara, Jarrett Powers, Kristin Lewis, Paul R. Houser, K. C. McDonald, Peter Toose, An-Ming Wu, Eugenia De Marco, Chris Derksen, Jared Entin, Andreas Colliander, Xiaolan Xu, Alex Mavrovic, ","Abstract A field campaign was conducted October 30th to November 13th, 2015 with the intention of capturing diurnal soil freeze/thaw state at multiple scales using ground measurements and remote sensing measurements. On four of the five sampling days, we observed a significant difference between morning (frozen scenario) and afternoon (thawed scenario) ground-based measurements of the soil relative permittivity. These results were supported by an in situ soil moisture and temperature network (installed at the scale of a spaceborne passive microwave pixel) which indicated surface soil temperatures fell below 0 °C for the same four sampling dates. Ground-based radiometers appeared to be highly sensitive to F/T conditions of the very surface of the soil and indicated normalized polarization index (NPR) values that were below the defined freezing values during the morning sampling period on all sampling dates. The Scanning L-band Active Passive (SLAP) instrumentation, flown over the study region, showed very good agreement with the ground-based radiometers, with freezing states observed on all four days that the airborne observations covered the fields with ground-based radiometers. The Soil Moisture Active Passive (SMAP) satellite had morning overpasses on three of the sampling days, and indicated frozen conditions on two of those days. It was found that >60% of the in situ network had to indicate surface temperatures below 0 °C before SMAP indicated freezing conditions. This was also true of the SLAP radiometer measurements. The SMAP, SLAP and ground-based radiometer measurements all indicated freezing conditions when soil temperature sensors installed at 5 cm depth were not frozen.",G18-112001,59-70,10.1016/j.rse.2018.04.003,Rowlandson-2018-Capturing,Transformative Sensor Technologies and Smart Watersheds for Canadian Water Futures
Improving in-lake water quality modeling using variable chlorophyll a/algal biomass ratios,"Amir Sadeghian, Steven C. Chapra, Jeff J. Hudson, H. S. Wheater, Karl–Erich Lindenschmidt, ","Abstract Algal simulations in many water quality models perform poorly because of oversimplifications in the process descriptions of the algae growth mechanisms. In this study, algae simulations were improved by implementing variable chlorophyll a/algal biomass ratios in the CE-QUAL-W2 model, a sophisticated two-dimensional laterally-averaged water quality model. Originally a constant in the model, the chlorophyll a/algal biomass ratio was reprogrammed to vary according to the nutrient and light limiting conditions in the water column. The modified model was tested on Lake Diefenbaker, a prairie reservoir in Saskatchewan, Canada, where, similar to many other lakes in the world, field observations confirm variable spatiotemporal ratios between chlorophyll a and algal biomass. The modified version yielded more accurate simulations compared to the standard version and provides a promising algorithm to improve results for many lakes and reservoirs globally.",G18-113001,73-85,10.1016/j.envsoft.2017.12.009,Sadeghian-2018-Improving,Integrated Modelling Program for Canada (IMPC)
Determination of fire risk to assist fire management for insular areas: the case of a small Greek island,"Stavros Sakellariou, Stergios Tampekis, Fani Samara, Mike D. Flannigan, Dirk Jaeger, Olga Christopoulou, Athanassios Sfougaris, ","Forest fire risk estimation constitutes an essential process to prevent high-intensity fires which are associated with severe implications to the natural and cultural environment. The primary aim of this research was to determine fire risk levels based on the local features of an island, namely, the impact of fuel structures, slope, aspects, as well as the impact of the road network and inhabited regions. The contribution of all the involved factors to forest fires ignition and behavior highlight certain regions which are highly vulnerable. In addition, the influence of both natural and anthropogenic factors to forest fire phenomena is explored. In this study, natural factors play a dominant role compared to anthropogenic factors. Hence essential preventative measures must focus on specific areas and established immediately. Indicative measures may include: the optimal allocation of watchtowers as well as the spatial optimization of mobile firefighting vehicles; and, forest fuel treatments in areas characterized by extremely high fire risk. The added value of this fire prediction tool is that it is highly flexible and could be adopted elsewhere with the necessary adjustments to local characteristics.",G18-114001,589-601,10.1007/s11676-018-0666-x,Sakellariou-2018-Determination,Boreal Water Futures: Canada’s Boreal Wildlands-Society-Water Nexus
Avoiding the Guise of an Anonymous Review,"Razi Sheikholeslami, Saman Razavi, ","Anonymous review of scientific manuscripts was intended to encourage reviewers to speak freely, but other models may be better for accountability and inclusivity.",G18-115001,,10.1029/2018eo098217,Sheikholeslami-2018-Avoiding,Integrated Modelling Program for Canada (IMPC)
Assessing local adaptation vs. plasticity under different resource conditions in seedlings of a dominant boreal tree species,"Anastasia E. Sniderhan, Gordon G. McNickle, Jennifer L. Baltzer, ","Under changing climate conditions, understanding local adaptation of plants is crucial to predicting the resilience of ecosystems. We selected black spruce (Picea mariana), the most dominant tree species in the North American boreal forest, in order to evaluate local adaptation vs. plasticity across regions experiencing some of the most extreme climate warming globally. Seeds from three provenances across the latitudinal extent of this species in northwestern Canada were planted in a common garden study in growth chambers. Two levels of two resource conditions were applied (low/high nutrient and ambient/elevated CO2) in a fully factorial design and we measured physiological traits, allocational traits, growth and survival. We found significant differences in height, root length and biomass among populations, with southern populations producing the largest seedlings. However, we did not detect meaningful significant differences among nutrient or CO2 treatments in any traits measured, and there were no consistent population-level differences in physiological traits or allocation patterns. We found that there was greater mortality after simulated winter in the high nutrient treatment, which may reflect an important shift in seedling growth strategies under increased resource availability. Our study provides important insight into how this dominant boreal tree species might respond to the changing climate conditions predicted in this region.",G18-116001,,10.1093/aobpla/ply004,Sniderhan-2018-Assessing,Core Technical Team
"Water table dynamics in a constructed wetland, Fort McMurray, Alberta","Haley M. Spennato, Scott J. Ketcheson, Carl Mendoza, Sean K. Carey, ","Surface mining in northern Alberta transforms wetlands and forests into open pits, tailings ponds, and overburden. As part of their license to operate, mine operators are required to reclaim this altered landscape to a predisturbance capacity. In 2012, Syncrude Canada Limited constructed one of the first of two reclaimed wetlands, the Sandhill Fen Watershed (SFW), to evaluate wetland reclamation strategies. SFW is a 52-ha system atop soft-tailings that includes an inflow/outflow pump system, underdrains, upland hummocks, and a fen lowland. In this study, water table dynamics of the fen lowland were evaluated in the 2 years following commissioning (2014–2015) to assess whether this newly constructed watershed has hydrological conditions that facilitate hydric soils with water table regimes similar to reference systems. Results indicate that the location and hydrophysical properties of placed materials control water table responses to both water management and precipitation. This differential water table response in the SFW lowland drove lateral fluxes between adjacent landforms, suggesting periods of intermittent water supply from uplands to wetlands along hummock margins. As in natural systems, the lowland fen exhibited several lateral flow reversals over the 2 years depending upon water level. Water tables on-average were greater than those observed in natural analogues. Comparison during these first 2 years following commissioning contribute to the increasing insight as to how construction and management practices support reclamation postmining.",G18-117001,3824-3836,10.1002/hyp.13308,Spennato-2018-Water,Boreal Water Futures: Canada’s Boreal Wildlands-Society-Water Nexus
Precipitation characteristics and associated weather conditions on the eastern slopes of the Canadian Rockies during March–April 2015,"Julie M. Thériault, Ida Hung, Paul Vaquer, Ronald E. Stewart, John W. Pomeroy, ","Abstract. Precipitation events that bring rain and snow to the Banff–Calgary area of Alberta are a critical aspect of the region's water cycle and can lead to major flooding events such as the June 2013 event that was the second most costly natural disaster in Canadian history. Because no special atmospheric-oriented observations of these events have been made, a field experiment was conducted in March and April 2015 in Kananaskis, Alberta, to begin to fill this gap. The goal was to characterize and better understand the formation of the precipitation at the surface during spring 2015 at a specific location in the Kananaskis Valley. Within the experiment, detailed measurements of precipitation and weather conditions were obtained, a vertically pointing Doppler radar was deployed and weather balloons were released. Although 17 precipitation events occurred, this period was associated with much less precipitation than normal (−35 %) and above-normal temperatures (2.5 ∘C). Of the 133 h of observed precipitation, solid precipitation occurred 71 % of the time, mixed precipitation occurred 9 % and rain occurred 20 %. An analysis of 17 504 precipitation particles from 1181 images showed that a wide variety of crystals and aggregates occurred and approximately 63 % showed signs of riming. This was largely independent of whether flows aloft were upslope (easterly) or downslope (westerly). In the often sub-saturated surface conditions, hydrometeors containing ice occurred at temperatures as high as 9 ∘C. Radar structures aloft were highly variable with reflectivity sometimes >30 dBZe and Doppler velocity up to −1 m s−1, which indicates upward motion of particles within ascending air masses. Precipitation was formed in this region within cloud fields sometimes having variable structures and within which supercooled water at least sometimes existed to produce accreted particles massive enough to reach the surface through the relatively dry sub-cloud region.",G18-118001,4491-4512,10.5194/hess-22-4491-2018,Thériault-2018-Precipitation,SPADE: Storms and Precipitation Across the Continental Divide Experiment
"The predictability of a lake phytoplankton community, over time-scales of hours to years","Mridul K. Thomas, Simone Fontana, Marta Reyes, Michael Kehoe, Francesco Pomati, ","Forecasting changes to ecological communities is one of the central challenges in ecology. However, nonlinear dependencies, biotic interactions and data limitations have limited our ability to assess how predictable communities are. Here, we used a machine learning approach and environmental monitoring data (biological, physical and chemical) to assess the predictability of phytoplankton cell density in one lake across an unprecedented range of time-scales. Communities were highly predictable over hours to months: model R2 decreased from 0.89 at 4 hours to 0.74 at 1 month, and in a long-term dataset lacking fine spatial resolution, from 0.46 at 1 month to 0.32 at 10 years. When cyanobacterial and eukaryotic algal cell densities were examined separately, model-inferred environmental growth dependencies matched laboratory studies, and suggested novel trade-offs governing their competition. High-frequency monitoring and machine learning can set prediction targets for process-based models and help elucidate the mechanisms underlying ecological dynamics.",G18-119001,619-628,10.1111/ele.12927,Thomas-2018-The,FORMBLOOM: Forecasting Tools and Mitigation Options for Diverse Bloom-Affected Lakes
Legacy nitrogen may prevent achievement of water quality goals in the Gulf of Mexico,"K. J. Van Meter, Philippe Van Cappellen, Nandita B. Basu, ","Haunted by the past Reducing the extent of hypoxia in the Gulf of Mexico will not be as easy as reducing agricultural nitrogen use. Van Meter et al. report that so much nitrogen from runoff has accumulated in the Mississippi River basin that, even if future agricultural nitrogen inputs are eliminated, it will still take 30 years to realize the 60% decrease in load needed to reduce eutrophication in the Gulf. This legacy effect means that a dramatic shift in land-use practices, which may not be compatible with current levels of agricultural production, will be needed to control hypoxia in the Gulf of Mexico. Science , this issue p. 427",G18-120001,427-430,10.1126/science.aar4462,Van Meter-2018-Legacy,Lake Futures: Enhancing Adaptive Capacity and Resilience of Lakes and their Watersheds
