title,author,abstract,url,pages,doi,bibkey,project
Disturbance Impacts on Thermal Hot Spots and Hot Moments at the Peatland-Atmosphere Interface,"Rhoswen Leonard, Nicholas Kettridge, K. J. Devito, Richard M. Petrone, Carl Mendoza, J. M. Waddington, Stefan Krause, ","Soil‐surface temperature acts as a master variable driving nonlinear terrestrial ecohydrological, biogeochemical, and micrometeorological processes, inducing short‐lived or spatially isolated extremes across heterogeneous landscape surfaces. However, subcanopy soil‐surface temperatures have been, to date, characterized through isolated, spatially discrete measurements. Using spatially complex forested northern peatlands as an exemplar ecosystem, we explore the high‐resolution spatiotemporal thermal behavior of this critical interface and its response to disturbances by using Fiber‐Optic Distributed Temperature Sensing. Soil‐surface thermal patterning was identified from 1.9 million temperature measurements under undisturbed, trees removed and vascular subcanopy removed conditions. Removing layers of the structurally diverse vegetation canopy not only increased mean temperatures but it shifted the spatial and temporal distribution, range, and longevity of thermal hot spots and hot moments. We argue that linking hot spots and/or hot moments with spatially variable ecosystem processes and feedbacks is key for predicting ecosystem function and resilience.",G18-65001,185-193,10.1002/2017gl075974,Leonard-2018-Disturbance,Boreal Water Futures: Canada’s Boreal Wildlands-Society-Water Nexus
Highly active fluorogenic oxidase-mimicking NiO nanozymes,"Li Dai, Biwu Liu, Po‐Jung Jimmy Huang, Zijie Zhang, Juewen Liu, ","NiO nanoparticles can quickly catalyze oxidation of Amplex red to produce fluorescent products for intracellular imaging, much more efficiently than other types of tested nanozymes.",G18-66001,12519-12522,10.1039/c8cc07062h,Li-2018-Highly,Sensors and Sensing Systems for Water Quality Monitoring
Application of Environmental DNA Metabarcoding for Predicting Anthropogenic Pollution in Rivers,"Feilong Li, Ying Peng, Wendi Fang, Florian Altermatt, Yuwei Xie, Jianghua Yang, Xiaowei Zhang, ","Rivers are among the most threatened freshwater ecosystems, and anthropogenic activities are affecting both river structures and water quality. While assessing the organisms can provide a comprehensive measure of a river's ecological status, it is limited by the traditional morphotaxonomy-based biomonitoring. Recent advances in environmental DNA (eDNA) metabarcoding allow to identify prokaryotes and eukaryotes in one sequencing run, and could thus allow unprecedented resolution. Whether such eDNA-based data can be used directly to predict the pollution status of rivers as a complementation of environmental data remains unknown. Here we used eDNA metabarcoding to explore the main stressors of rivers along which community structure changes, and to identify the method's potential for predicting pollution status based on eDNA data. We showed that a broad range of taxa in bacterial, protistan, and metazoan communities could be profiled with eDNA. Nutrients were the main driving stressor affecting communities' structure, alpha diversity, and the ecological network. We specifically observed that the relative abundance of indicative OTUs was significantly correlated with nutrient levels. These OTUs data could be used to predict the nutrient status up to 79% accuracy on testing data sets. Thus, our study gives a novel approach to predicting the pollution status of rivers by eDNA data.",G18-67001,,10.1021/acs.est.8b03869,Li-2018-Application,(eDNA) Next Generation Solutions to Ensure Healthy Water Resources for Future Generations
Indices of Canada’s future climate for general and agricultural adaptation applications,"Guilong Li, Xuebin Zhang, Alex J. Cannon, Trevor Q. Murdock, S. R. Sobie, Francis W. Zwiers, Kevin Anderson, Budong Qian, ","This study evaluates regional-scale projections of climate indices that are relevant to climate change impacts in Canada. We consider indices of relevance to different sectors including those that describe heat conditions for different crop types, temperature threshold exceedances relevant for human beings and ecological ecosystems such as the number of days temperatures are above certain thresholds, utility relevant indices that indicate levels of energy demand for cooling or heating, and indices that represent precipitation conditions. Results are based on an ensemble of high-resolution statistically downscaled climate change projections from 24 global climate models (GCMs) under the RCP2.6, RCP4.5, and RCP8.5 emissions scenarios. The statistical downscaling approach includes a bias-correction procedure, resulting in more realistic indices than those computed from the original GCM data. We find that the level of projected changes in the indices scales well with the projected increase in the global mean temperature and is insensitive to the emission scenarios. At the global warming level about 2.1 °C above pre-industrial (corresponding to the multi-model ensemble mean for 2031–2050 under the RCP8.5 scenario), there is almost complete model agreement on the sign of projected changes in temperature indices for every region in Canada. This includes projected increases in extreme high temperatures and cooling demand, growing season length, and decrease in heating demand. Models project much larger changes in temperature indices at the higher 4.5 °C global warming level (corresponding to 2081–2100 under the RCP8.5 scenario). Models also project an increase in total precipitation, in the frequency and intensity of precipitation, and in extreme precipitation. Uncertainty is high in precipitation projections, with the result that models do not fully agree on the sign of changes in most regions even at the 4.5 °C global warming level.",G18-68001,249-263,10.1007/s10584-018-2199-x,Li-2018-Indices,Climate-Related Precipitation Extremes
Solar‐induced chlorophyll fluorescence is strongly correlated with terrestrial photosynthesis for a wide variety of biomes: First global analysis based on OCO‐2 and flux tower observations,"Xing Li, Jingfeng Xiao, Bin He, M. Altaf Arain, Jason Beringer, Ankur R. Desai, Carmen Emmel, David Y. Hollinger, Alisa Krasnova, Ivan Mammarella, Steffen M. Noe, Penélope Serrano-Ortiz, Camilo Rey‐Sánchez, A. V. Rocha, Andrej Varlagin, ","Solar-induced chlorophyll fluorescence (SIF) has been increasingly used as a proxy for terrestrial gross primary productivity (GPP). Previous work mainly evaluated the relationship between satellite-observed SIF and gridded GPP products both based on coarse spatial resolutions. Finer resolution SIF (1.3 km × 2.25 km) measured from the Orbiting Carbon Observatory-2 (OCO-2) provides the first opportunity to examine the SIF–GPP relationship at the ecosystem scale using flux tower GPP data. However, it remains unclear how strong the relationship is for each biome and whether a robust, universal relationship exists across a variety of biomes. Here we conducted the first global analysis of the relationship between OCO-2 SIF and tower GPP for a total of 64 flux sites across the globe encompassing eight major biomes. OCO-2 SIF showed strong correlations with tower GPP at both midday and daily timescales, with the strongest relationship observed for daily SIF at the 757 nm (R2 = 0.72, p < 0.0001). Strong linear relationships between SIF and GPP were consistently found for all biomes (R2 = 0.57–0.79, p < 0.0001) except evergreen broadleaf forests (R2 = 0.16, p < 0.05) at the daily timescale. A higher slope was found for C4 grasslands and croplands than for C3 ecosystems. The generally consistent slope of the relationship among biomes suggests a nearly universal rather than biome-specific SIF–GPP relationship, and this finding is an important distinction and simplification compared to previous results. SIF was mainly driven by absorbed photosynthetically active radiation and was also influenced by environmental stresses (temperature and water stresses) that determine photosynthetic light use efficiency. OCO-2 SIF generally had a better performance for predicting GPP than satellite-derived vegetation indices and a light use efficiency model. The universal SIF–GPP relationship can potentially lead to more accurate GPP estimates regionally or globally. Our findings revealed the remarkable ability of finer resolution SIF observations from OCO-2 and other new or future missions (e.g., TROPOMI, FLEX) for estimating terrestrial photosynthesis across a wide variety of biomes and identified their potential and limitations for ecosystem functioning and carbon cycle studies.",G18-69001,3990-4008,10.1111/gcb.14297,Li-2018-Solar‐induced,Southern Forests Water Futures
Cross‐scale controls on carbon emissions from boreal forest megafires,"Xanthe J. Walker, Brendan M. Rogers, Jennifer L. Baltzer, Steven G. Cumming, Nicola J. Day, Scott J. Goetz, Jill F. Johnstone, Edward A. G. Schuur, M. R. Turetsky, Michelle C. Mack, ","Climate warming and drying is associated with increased wildfire disturbance and the emergence of megafires in North American boreal forests. Changes to the fire regime are expected to strongly increase combustion emissions of carbon (C) which could alter regional C balance and positively feedback to climate warming. In order to accurately estimate C emissions and thereby better predict future climate feedbacks, there is a need to understand the major sources of heterogeneity that impact C emissions at different scales. Here, we examined 211 field plots in boreal forests dominated by black spruce (Picea mariana) or jack pine (Pinus banksiana) of the Northwest Territories (NWT), Canada after an unprecedentedly large area burned in 2014. We assessed both aboveground and soil organic layer (SOL) combustion, with the goal of determining the major drivers in total C emissions, as well as to develop a high spatial resolution model to scale emissions in a relatively understudied region of the boreal forest. On average, 3.35 kg C m−2 was combusted and almost 90% of this was from SOL combustion. Our results indicate that black spruce stands located at landscape positions with intermediate drainage contribute the most to C emissions. Indices associated with fire weather and date of burn did not impact emissions, which we attribute to the extreme fire weather over a short period of time. Using these results, we estimated a total of 94.3 Tg C emitted from 2.85 Mha of burned area across the entire 2014 NWT fire complex, which offsets almost 50% of mean annual net ecosystem production in terrestrial ecosystems of Canada. Our study also highlights the need for fine-scale estimates of burned area that represent small water bodies and regionally specific calibrations of combustion that account for spatial heterogeneity in order to accurately model emissions at the continental scale.",G18-69002,4251-4265,10.1111/gcb.14287,Walker-2018-Cross‐scale,Northern Water Futures
"Coherence of Radarsat-2, Sentinel-1, and ALOS-1 PALSAR for monitoring spatiotemporal variations of river ice covers","Zhaoqin Li, Karl–Erich Lindenschmidt, ",Monitoring spatiotemporal variations of river ice covers is critical for selecting safe ice transportation routes. The coherence of synthetic aperture radar (SAR) interferometry (InSAR) conveys imp...,G18-70001,11-25,10.1080/07038992.2018.1419424,Li-2018-Coherence,Integrated Modelling Program for Canada (IMPC)
Monitoring river ice cover development using the Freeman–Durden decomposition of quad-pol Radarsat-2 images,"Karl–Erich Lindenschmidt, Zhaoqin Li, ","The monitoring of river ice development is a crucial guidance indicator to establish safe crossings along river ice covers. This is the first study, based on our knowledge, to understand the interactions between river ice cover structures and radar signals and to further monitor ice development using C-band synthetic aperture radar images. The study was applied to the Slave River, Canada, using the Freeman–Durden decomposition of quad-pol C-band Radarsat-2 FQ14W images and ice core crystallography analysis. Results demonstrate that the combination of volume and surface scattering can be used to monitor ice cover development that cannot be interpreted from single polarization images, such as Radarsat-2 spotlight images used in this study. These results indicate that the decomposed quad-pol Radarsat-2 images can provide a more effective guide than the single-pol Radarsat-2 SLA images to select safe ice transportation routes. This decomposition approach can be extended to other snow and ice covered rivers.",G18-71001,1,10.1117/1.jrs.12.026014,Lindenschmidt-2018-Monitoring,Integrated Modelling Program for Canada (IMPC)
Reviews and syntheses: Changing ecosystem influences on soil thermal regimes in northern high-latitude permafrost regions,"M. M. Loranty, Benjamin W. Abbott, Daan Blok, Thomas A. Douglas, Howard E. Epstein, Bruce C. Forbes, Benjamin Jones, Alexander Kholodov, Heather Kropp, Avni Malhotra, Steven D. Mamet, Isla H. Myers‐Smith, Susan M. Natali, J. A. O’Donnell, Gareth K. Phoenix, A. V. Rocha, Oliver Sonnentag, Ken D. Tape, Donald A. Walker, ","Abstract. Soils in Arctic and boreal ecosystems store twice as much carbon as the atmosphere, a portion of which may be released as high-latitude soils warm. Some of the uncertainty in the timing and magnitude of the permafrost–climate feedback stems from complex interactions between ecosystem properties and soil thermal dynamics. Terrestrial ecosystems fundamentally regulate the response of permafrost to climate change by influencing surface energy partitioning and the thermal properties of soil itself. Here we review how Arctic and boreal ecosystem processes influence thermal dynamics in permafrost soil and how these linkages may evolve in response to climate change. While many of the ecosystem characteristics and processes affecting soil thermal dynamics have been examined individually (e.g., vegetation, soil moisture, and soil structure), interactions among these processes are less understood. Changes in ecosystem type and vegetation characteristics will alter spatial patterns of interactions between climate and permafrost. In addition to shrub expansion, other vegetation responses to changes in climate and rapidly changing disturbance regimes will affect ecosystem surface energy partitioning in ways that are important for permafrost. Lastly, changes in vegetation and ecosystem distribution will lead to regional and global biophysical and biogeochemical climate feedbacks that may compound or offset local impacts on permafrost soils. Consequently, accurate prediction of the permafrost carbon climate feedback will require detailed understanding of changes in terrestrial ecosystem distribution and function, which depend on the net effects of multiple feedback processes operating across scales in space and time.",G18-72001,5287-5313,10.5194/bg-15-5287-2018,Loranty-2018-Reviews,Northern Water Futures
"Comparison of Big‐Leaf, Two‐Big‐Leaf, and Two‐Leaf Upscaling Schemes for Evapotranspiration Estimation Using Coupled Carbon‐Water Modeling","Xiangzhong Luo, Jing M. Chen, Jane Liu, T. Andrew Black, Holly Croft, R. M. Staebler, Li He, M. Altaf Arain, Bin Chen, Gang Mo, Alemu Gonsamo, Harry McCaughey, ","Author(s): Luo, X; Chen, JM; Liu, J; Black, TA; Croft, H; Staebler, R; He, L; Arain, MA; Chen, B; Mo, G; Gonsamo, A; McCaughey, H | Abstract: Evapotranspiration (ET) is commonly estimated using the Penman-Monteith equation, which assumes that the plant canopy is a big leaf (BL) and the water flux from vegetation is regulated by canopy stomatal conductance (Gs). However, BL has been found to be unsuitable for terrestrial biosphere models built on the carbon-water coupling principle because it fails to capture daily variations of gross primary productivity (GPP). A two-big-leaf scheme (TBL) and a two-leaf scheme (TL) that stratify a canopy into sunlit and shaded leaves have been developed to address this issue. However, there is a lack of comparison of these upscaling schemes for ET estimation, especially on the difference between TBL and TL. We find that TL shows strong performance (r2n=n0.71, root-mean-square errorn=n0.05nmm/h) in estimating ET at nine eddy covariance towers in Canada. BL simulates lower annual ET and GPP than TL and TBL. The biases of estimated ET and GPP increase with leaf area index (LAI) in BL and TBL, and the biases of TL show no trends with LAI. BL miscalculates the portions of light-saturated and light-unsaturated leaves in the canopy, incurring negative biases in its flux estimation. TBL and TL showed improved yet different GPP and ET estimations. This difference is attributed to the lower Gs and intercellular CO2 concentration simulated in TBL compared to their counterparts in TL. We suggest to use TL for ET modeling to avoid the uncertainty propagated from the artificial upscaling of leaf-level processes to the canopy scale in BL and TBL.",G18-73001,207-225,10.1002/2017jg003978,Luo-2018-Comparison,Southern Forests Water Futures
Validation of the SMAP freeze/thaw product using categorical triple collocation,"Haobo Lyu, Kaighin A. McColl, Xinlu Li, Chris Derksen, Aaron Berg, T. A. Black, Eugénie Euskirchen, M. M. Loranty, Jouni Pulliainen, Kimmo Rautiainen, Tracy Rowlandson, Alexandre Roy, A. Royer, Alexandre Langlois, Jilmarie Stephens, Hui Lu, Dara Entekhabi, ","Abstract The landscape freeze/thaw (FT) state plays an important role in local, regional and global weather and climate, but is difficult to monitor. The Soil Moisture Active Passive (SMAP) satellite mission provides hemispheric estimates of landscape FT state at a spatial resolution of approximately 36 2  km 2 . Previous validation studies of SMAP and other satellite FT products have compared satellite retrievals with point estimates obtained from in-situ measurements of air and/or soil temperature. Differences between the two are attributed to errors in the satellite retrieval. However, significant differences can occur between satellite and in-situ estimates solely due to differences in scale between the measurements; these differences can be viewed as ‘representativeness errors’ in the in-situ product, caused by using a point estimate to represent a large-scale spatial average. Most previous validation studies of landscape FT state have neglected representativeness errors entirely, resulting in conservative estimates of satellite retrieval skill. In this study, we use a variant of triple collocation called ‘categorical triple collocation’ – a technique that uses model, satellite and in-situ estimates to obtain relative performance rankings of all three products, without neglecting representativeness errors – to validate the SMAP landscape FT product. Performance rankings are obtained for nine sites at northern latitudes. We also investigate differences between using air or soil temperatures to estimate FT state, and between using morning (6 AM) or evening (6 PM) estimates. Overall, at most sites, the SMAP product or in-situ FT measurement is ranked first, and the model FT product is ranked last (although rankings vary across sites). These results suggest SMAP is adding value to model simulations, providing higher-accuracy estimates of landscape FT states compared to models and, in some cases, even in-situ estimates, when representativeness errors are properly accounted for in the validation analysis.",G18-74001,329-337,10.1016/j.rse.2017.12.007,Lyu-2018-Validation,Transformative Sensor Technologies and Smart Watersheds for Canadian Water Futures
The role of groundwater discharge fluxes on Si:P ratios in a major tributary to Lake Erie,"Taylor Maavara, Stephanie Slowinski, Fereidoun Rezanezhad, K. J. Van Meter, Philippe Van Cappellen, ","Groundwater discharge can be a major source of nutrients to river systems. Although quantification of groundwater nitrate loading to streams is common, the dependence of surface water silicon (Si) and phosphorus (P) concentrations on groundwater sources has rarely been determined. Additionally, the ability of groundwater discharge to drive surface water Si:P ratios has not been contextualized relative to riverine inputs or in-stream transformations. In this study, we quantify the seasonal dynamics of Si and P cycles in the Grand River (GR) watershed, the largest Canadian watershed draining into Lake Erie, to test our hypothesis that regions of Si-rich groundwater discharge increase surface water Si:P ratios. Historically, both the GR and Lake Erie have been considered stoichiometrically P-limited, where the molar Si:P ratio is greater than the ~16:1 phytoplankton uptake ratio. However, recent trends suggest that eastern Lake Erie may be approaching Si-limitation. We sampled groundwater and surface water for dissolved and reactive particulate Si as well as total dissolved P for 12months within and downstream of a 50-km reach of high groundwater discharge. Our results indicate that groundwater Si:P ratios are lower than the corresponding surface water and that groundwater is a significant source of bioavailable P to surface water. Despite these observations, the watershed remains P-limited for the majority of the year, with localized periods of Si-limitation. We further find that groundwater Si:P ratios are a relatively minor driver of surface water Si:P, but that the magnitude of Si and P loads from groundwater represent a large proportion of the overall fluxes to Lake Erie.",G18-75001,814-824,10.1016/j.scitotenv.2017.12.024,Maavara-2018-The,Lake Futures: Enhancing Adaptive Capacity and Resilience of Lakes and their Watersheds
Water and energy fluxes over northern prairies as affected by chinook winds and winter precipitation,"Matthew K. MacDonald, John W. Pomeroy, Richard Essery, ","Abstract Chinooks are the North American variety of foehn: strong, warm and dry winds that descend lee mountain slopes. The strong wind speeds, high temperatures and substantial humidity deficits have been hypothesized to remove important prairie near-surface water storage from agricultural fields via evaporation, sublimation and blowing snow, as well as change the phase of near surface water via snowmelt and ground thaw. This paper presents observations of surface energy and water balances from eddy covariance instrumentation deployed at three open sites in southern Alberta, Canada during winter 2011–2012. Energy balances, snow and soil moisture budgets of three select chinook events were analysed in detail. These three events ranged in duration from two to nine days, and are representative of winter through early spring chinooks. Precipitation data from gauges and reanalyses (CaPA and ERA-interim) were used to assess water balances. Variations in precipitation and snowpacks caused the greatest differences in energy and water balances. Cumulative winter precipitation varied by a factor of two over the three sites: heaviest at the more northern site immediately east of the Rocky Mountains and lightest at the easternmost and southernmost site. The temporal progression of chinook-driven surface water loss is explained, beginning with strong blowing snow events through to evaporation of meltwater as snowpacks disappear. At the two sites with considerable winter precipitation and snowcover, large upward latent heat fluxes, often exceeding 100 W m−2, were driven by downward sensible heat fluxes but were unrelated to net radiation. Conversely, at the southernmost site with little snowcover, upward latent heat fluxes were much smaller (less than 50 W m−2) and were associated with periods of positive net radiation. Upward sensible heat fluxes during periods of positive net radiation were observed at this site throughout winter, but were not observed at the more northerly sites until March when the snowcovers ablated. Daily sublimation plus evaporation rates during chinooks at the sites with heaviest and lightest precipitation were 1.3–2.1 mm/day and 0.1–0.3 mm/day, respectively. Evaporation of soil water occurred while soils were partially to fully unfrozen in November. There was little change in soil water content between fall freeze-up and spring thaw (December through most of March), indicating that over-winter infiltration was balanced by soil water evaporation and both terms were likely to be small. Winter precipitation resulted in only 2% to 4% increases in near-surface water storage at the more northern sites with greater precipitation, whereas there was a net loss over winter at the southernmost site.",G18-76001,372-385,10.1016/j.agrformet.2017.10.025,MacDonald-2018-Water,SPADE: Storms and Precipitation Across the Continental Divide Experiment
