title,author,abstract,url,pages,doi,bibkey
Recommending Comprehensive Solutions for Programming Tasks by Mining Crowd Knowledge,"Rodrigo F.G. Silva, Chanchal K. Roy, Mohammad Masudur Rahman, Kevin A. Schneider, Klerisson Paixao, Marcelo de Almeida Maia, ","Developers often search for relevant code examples on the web for their programming tasks. Unfortunately, they face two major problems. First, the search is impaired due to a lexical gap between their query (task description) and the information associated with the solution. Second, the retrieved solution may not be comprehensive, i.e., the code segment might miss a succinct explanation. These problems make the developers browse dozens of documents in order to synthesize an appropriate solution. To address these two problems, we propose CROKAGE (Crowd Knowledge Answer Generator), a tool that takes the description of a programming task (the query) and provides a comprehensive solution for the task. Our solutions contain not only relevant code examples but also their succinct explanations. Our proposed approach expands the task description with relevant API classes from Stack Overflow Q & A threads and then mitigates the lexical gap problems. Furthermore, we perform natural language processing on the top quality answers and then return such programming solutions containing code examples and code explanations unlike earlier studies. We evaluate our approach using 97 programming queries, of which 50% was used for training and 50% was used for testing, and show that it outperforms six baselines including the state-of-art by a statistically significant margin. Furthermore, our evaluation with 29 developers using 24 tasks (queries) confirms the superiority of CROKAGE over the state-of-art tool in terms of relevance of the suggested code examples, benefit of the code explanations and the overall solution quality (code + explanation).",G19-77002,,10.1109/icpc.2019.00054,Silva-2019-Recommending
"Quantifying projected changes in runoff variability and flow regimes of the Fraser River Basin, British Columbia","Siraj Ul Islam, Charles L. Curry, Stephen J. Déry, Francis W. Zwiers, ","Abstract. In response to ongoing and future-projected global warming, mid-latitude, nival river basins are expected to transition from a snowmelt-dominated flow regime to a nival–pluvial one with an earlier spring freshet of reduced magnitude. There is, however, a rich variation in responses that depends on factors such as the topographic complexity of the basin and the strength of maritime influences. We illustrate the potential effects of a strong maritime influence by studying future changes in cold season flow variability in the Fraser River Basin (FRB) of British Columbia, a large extratropical watershed extending from the Rocky Mountains to the Pacific Coast. We use a process-based hydrological model driven by an ensemble of 21 statistically downscaled simulations from the Coupled Model Intercomparison Project Phase 5 (CMIP5), following the Representative Concentration Pathway 8.5 (RCP 8.5). Warming under RCP 8.5 leads to reduced winter snowfall, shortening the average snow accumulation season by about one-third. Despite this, large increases in cold season rainfall lead to unprecedented cold season peak flows and increased overall runoff variability in the VIC simulations. Increased cold season rainfall is shown to be the dominant climatic driver in the Coast Mountains, contributing 60 % to mean cold season runoff changes in the 2080s. Cold season runoff at the outlet of the basin increases by 70 % by the 2080s, and its interannual variability more than doubles when compared to the 1990s, suggesting substantial challenges for operational flow forecasting in the region. Furthermore, almost half of the basin (45 %) transitions from a snow-dominated runoff regime in the 1990s to a primarily rain-dominated regime in the 2080s, according to a snowmelt pulse detection algorithm. While these projections are consistent with the anticipated transition from a nival to a nival–pluvial hydrologic regime, the marked increase in FRB cold season runoff is likely linked to more frequent landfalling atmospheric rivers in the region projected in the CMIP5 models, providing insights for other maritime-influenced extratropical basins.",G19-78001,811-828,10.5194/hess-23-811-2019,Islam-2019-Quantifying
Vanadium and thallium exhibit biodilution in a northern river food web,"Timothy D. Jardine, Lorne E. Doig, Paul D. Jones, Lalita Bharadwaj, Meghan Carr, Brett Tendler, Karl-Erich Lindenschmidt, ","Trophic transfer of contaminants dictates concentrations and potential toxic effects in top predators, yet biomagnification behaviour of many trace elements is poorly understood. We examined concentrations of vanadium and thallium, two globally-distributed and anthropogenically-enriched elements, in a food web of the Slave River, Northwest Territories, Canada. We found that tissue concentrations of both elements declined with increasing trophic position as measured by δ15N. Slopes of log [element] versus δ15N regressions were both negative, with a steeper slope for V (-0.369) compared with Tl (-0.099). These slopes correspond to declines of 94% with each step in the food chain for V and 54% with each step in the food chain for Tl. This biodilution behaviour for both elements meant that concentrations in fish were well below values considered to be of concern for the health of fish-eating consumers. Further study of these elements in food webs is needed to allow a fuller understanding of biomagnification patterns across a range of species and systems.",G19-79001,381-386,10.1016/j.chemosphere.2019.05.282,Jardine-2019-Vanadium
A hybrid partial and general equilibrium modeling approach to assess the hydro-economic impacts of large dams – The case of the Grand Ethiopian Renaissance Dam in the Eastern Nile River basin,"Tewodros Negash Kahsay, Diane Arjoon, Onno Kuik, Roy Brouwer, Amaury Tilmant, Pieter van der Zaag, ",A novel integrated hydro-economic modeling framework that links a bottom-up partial equilibrium (engineering) model with a top-down (economic) general equilibrium model is developed for assessing the regional economic impacts of water resources management and infrastructure development decisions in a transboundary river basin. The engineering model is employed first to solve the water allocation problem for a river system in a partial equilibrium setting. The resulting system-wide changes in optimal water allocation are subsequently fed into the general equilibrium model to provide an economy-wide perspective. This integrated hydro-economic modeling framework is illustrated using the Eastern Nile River basin as a case study. The engineering-based stochastic dual dynamic programming (SDDP) model of the Eastern Nile basin is coupled with the computable general equilibrium (CGE) model GTAP-W to assess the economy-wide impacts of the Grand Ethiopian Renaissance Dam (GERD) on the Eastern Nile economies.,G19-80001,76-88,10.1016/j.envsoft.2019.03.007,Kahsay-2019-A
Bi-directional hydrological changes in perched basins of the Athabasca Delta (Canada) in recent decades caused by natural processes,"M L Kay, J A Wiklund, C R Remmer, L K Neary, K Brown, A Ghosh, E MacDonald, K Thomson, J M Vucic, K Wesenberg, R I Hall, B B Wolfe, ",,G19-81001,081001,10.1088/2515-7620/ab37e7,Kay-2019-Bi-directional
Severe wildfire exposes remnant peat carbon stocks to increased post-fire drying,"N. Kettridge, M. C. Lukenbach, K. J. Hokanson, K. J. Devito, R. M. Petrone, C. A. Mendoza, J. M. Waddington, ","The potential of high severity wildfires to increase global terrestrial carbon emissions and exacerbate future climatic warming is of international concern. Nowhere is this more prevalent than within high latitude regions where peatlands have, over millennia, accumulated legacy carbon stocks comparable to all human CO2 emissions since the beginning of the industrial revolution. Drying increases rates of peat decomposition and associated atmospheric and aquatic carbon emissions. The degree to which severe wildfires enhance drying under future climates and induce instability in peatland ecological communities and carbon stocks is unknown. Here we show that high burn severities increased post-fire evapotranspiration by 410% within a feather moss peatland by burning through the protective capping layer that restricts evaporative drying in response to low severity burns. High burn severities projected under future climates will therefore leave peatlands that dominate dry sub-humid regions across the boreal, on the edge of their climatic envelopes, more vulnerable to intense post-fire drying, inducing high rates of carbon loss to the atmosphere that amplify the direct combustion emissions.",G19-82001,,10.1038/s41598-019-40033-7,Kettridge-2019-Severe
Identifying Climate-Induced Groundwater Depletion in GRACE Observations,"Brian F. Thomas, James S. Famiglietti, ","Depletion of groundwater resources has been identified in numerous global aquifers, suggesting that extractions have exceeded natural recharge rates in critically important global freshwater supplies. Groundwater depletion has been ascribed to groundwater pumping, often ignoring influences of direct and indirect consequences of climate variability. Here, we explore relations between natural and human drivers and spatiotemporal changes in groundwater storage derived from the Gravity Recovery and Climate Experiment (GRACE) satellites using regression procedures and dominance analysis. Changes in groundwater storage are found to be influenced by direct climate variability, whereby groundwater recharge and precipitation exhibited greater influence as compared to groundwater pumping. Weak influence of groundwater pumping may be explained, in part, by quasi-equilibrium aquifer conditions that occur after “long-time” pumping, while precipitation and groundwater recharge records capture groundwater responses linked to climate-induced groundwater depletion. Evaluating groundwater response to climate variability is critical given the reliance of groundwater resources to satisfy water demands and impending changes in climate variability that may threaten future water availability.",G19-82002,,10.1038/s41598-019-40155-y,Thomas-2019-Identifying
An Assessment of Surface and Atmospheric Conditions Associated with the Extreme 2014 Wildfire Season in Canada’s Northwest Territories,"Bohdan Kochtubajda, Ronald E. Stewart, Mike D. Flannigan, Barrie R. Bonsal, Charles Cuell, Curtis J. Mooney, ",Weather and climate are major factors influencing worldwide wildfire activity. This study assesses surface and atmospheric conditions associated with the 2014 extreme wildfires in the Northwest Ter...,G19-83001,73-90,10.1080/07055900.2019.1576023,Kochtubajda-2019-An
Impact of Future Climate and Vegetation on the Hydrology of an Arctic Headwater Basin at the Tundra–Taiga Transition,"Sebastian A. Krogh, John W. Pomeroy, ","Abstract The rapidly warming Arctic is experiencing permafrost degradation and shrub expansion. Future climate projections show a clear increase in mean annual temperature and increasing precipitation in the Arctic; however, the impact of these changes on hydrological cycling in Arctic headwater basins is poorly understood. This study investigates the impact of climate change, as represented by simulations using a high-resolution atmospheric model under a pseudo-global-warming configuration, and projected changes in vegetation, using a spatially distributed and physically based Arctic hydrological model, on a small headwater basin at the tundra–taiga transition in northwestern Canada. Climate projections under the RCP8.5 emission scenario show a 6.1°C warming, a 38% increase in annual precipitation, and a 19 W m−2 increase in all-wave annual irradiance over the twenty-first century. Hydrological modeling results suggest a shift in hydrological processes with maximum peak snow accumulation increasing by 70%, snow-cover duration shortening by 26 days, active layer deepening by 0.25 m, evapotranspiration increasing by 18%, and sublimation decreasing by 9%. This results in an intensification of the hydrological regime by doubling discharge volume, a 130% increase in spring runoff, and earlier and larger peak streamflow. Most hydrological changes were found to be driven by climate change; however, increasing vegetation cover and density reduced blowing snow redistribution and sublimation, and increased evaporation from intercepted rainfall. This study provides the first detailed investigation of projected changes in climate and vegetation on the hydrology of an Arctic headwater basin, and so it is expected to help inform larger-scale climate impact studies in the Arctic.",G19-84001,197-215,10.1175/jhm-d-18-0187.1,Krogh-2019-Impact
Citizen Social Science for More Integrative and Effective Climate Action: A Science-Policy Perspective,"Andrew P. Kythreotis, Chrystal Mantyka-Pringle, Theresa G. Mercer, Lorraine E. Whitmarsh, Adam Corner, Jouni Paavola, Chris Chambers, Byron A. Miller, Noel Castree, ","Governments are struggling to limit global temperatures below the 2°C Paris target with existing climate change policy approaches. This is because conventional climate policies have been predominantly (inter)nationally top-down, which limits citizen agency in driving policy change and influencing citizen behavior. Here we propose elevating Citizen Social Science (CSS) to a new level across governments as an advanced collaborative approach of accelerating climate action and policies that moves beyond conventional citizen science and participatory approaches. Moving beyond the traditional science-policy model of the democratization of science in enabling more inclusive climate policy change, we present examples of how CSS can potentially transform citizen behavior and enable citizens to become key agents in driving climate policy change. We also discuss the barriers that could impede the implementation of CSS and offer solutions to these. In doing this, we articulate the implications of increased citizen action through CSS in moving forward the broader normative and political program of transdisciplinary and co-productive climate change research and policy.",G19-85001,,10.3389/fenvs.2019.00010,Kythreotis-2019-Citizen
"The Community Land Model Version 5: Description of New Features, Benchmarking, and Impact of Forcing Uncertainty","David M. Lawrence, Rosie A. Fisher, Charles D. Koven, Keith W. Oleson, Sean C. Swenson, Gordon Bonan, Nathan Collier, Bardan Ghimire, Leo van Kampenhout, Daniel Kennedy, Erik Kluzek, Peter J. Lawrence, Fang Li, Hongyi Li, Danica Lombardozzi, William J. Riley, William J. Sacks, Mingjie Shi, Mariana Vertenstein, William R. Wieder, Chonggang Xu, Ashehad A. Ali, Andrew M. Badger, Gautam Bisht, Michiel van den Broeke, Michael A. Brunke, Sean P. Burns, Jonathan Buzan, Martyn Clark, Anthony Craig, Kyla Dahlin, Beth Drewniak, Joshua B. Fisher, Mark Flanner, Andrew M. Fox, Pierre Gentine, Forrest Hoffman, Gretchen Keppel‐Aleks, Ryan Knox, Sanjiv Kumar, Jan Lenaerts, L. Ruby Leung, William H. Lipscomb, Yaqiong Lu, Ashutosh Pandey, Jon D. Pelletier, Justin Perket, James T. Randerson, Daniel M. Ricciuto, Benjamin M. Sanderson, Andrew Slater, Zachary M. Subin, Jinyun Tang, R. Quinn Thomas, Maria Val Martin, Xubin Zeng, ","The Community Land Model (CLM) is the land component of the Community Earth System Model (CESM) and is used in several global and regional modeling systems. In this paper, we introduce model developments included in CLM version 5 (CLM5), which is the default land component for CESM2. We assess an ensemble of simulations, including prescribed and prognostic vegetation state, multiple forcing data sets, and CLM4, CLM4.5, and CLM5, against a range of metrics including from the International Land Model Benchmarking (ILAMBv2) package. CLM5 includes new and updated processes and parameterizations: (1) dynamic land units, (2) updated parameterizations and structure for hydrology and snow (spatially explicit soil depth, dry surface layer, revised groundwater scheme, revised canopy interception and canopy snow processes, updated fresh snow density, simple firn model, and Model for Scale Adaptive River Transport), (3) plant hydraulics and hydraulic redistribution, (4) revised nitrogen cycling (flexible leaf stoichiometry, leaf N optimization for photosynthesis, and carbon costs for plant nitrogen uptake), (5) global crop model with six crop types and time‐evolving irrigated areas and fertilization rates, (6) updated urban building energy, (7) carbon isotopes, and (8) updated stomatal physiology. New optional features include demographically structured dynamic vegetation model (Functionally Assembled Terrestrial Ecosystem Simulator), ozone damage to plants, and fire trace gas emissions coupling to the atmosphere. Conclusive establishment of improvement or degradation of individual variables or metrics is challenged by forcing uncertainty, parametric uncertainty, and model structural complexity, but the multivariate metrics presented here suggest a general broad improvement from CLM4 to CLM5.",G19-86001,4245-4287,10.1029/2018ms001583,Lawrence-2019-The
Representing Intrahillslope Lateral Subsurface Flow in the Community Land Model,"Sean C. Swenson, Martyn Clark, Ying Fan, David M. Lawrence, Justin Perket, ",,G19-86002,4044-4065,10.1029/2019ms001833,Swenson-2019-Representing
The potential to reduce uncertainty in regional runoff projections from climate models,"Flavio Lehner, Andrew W. Wood, Julie A. Vano, David M. Lawrence, Martyn P. Clark, Justin S. Mankin, ",,G19-87001,926-933,10.1038/s41558-019-0639-x,Lehner-2019-The
Simulation of Capillary Pressure Overshoot in Snow Combining Trapping of the Wetting Phase With a Nonequilibrium Richards Equation Model,"Nicolas R. Leroux, John W. Pomeroy, ",,G19-88001,236-248,10.1029/2018wr022969,Leroux-2019-Simulation
Temporal variation in zooplankton and phytoplankton community species composition and the affecting factors in Lake Taihu—a large freshwater lake in China,"Cuicui Li, Weiying Feng, Haiyan Chen, Xiaofeng Li, Fanhao Song, Wenjing Guo, John P. Giesy, Fuhong Sun, ","Monitoring diverse components of aquatic ecosystems is vital for elucidation of diversity dynamics and processes, which alter freshwater ecosystems, but such studies are seldom conducted. Phytoplankton and zooplankton are integral components which play indispensable parts in the structure and ecological service function of water bodies. However, few studies were made on how zooplankton and phytoplankton community may respond simultaneously to change of circumstance and their mutual relationship. Therefore, we researched synchronously the phytoplankton communities as well as zooplankton communities based on monthly monitoring data from September 2011 to August 2012 in heavily polluted areas and researched their responses to variation in environmental parameters and their mutual relationship. As indicated by Time-lag analysis (TLA), the long-term dynamics of phytoplankton and zooplankton were undergoing directional variations, what's more, there exists significant seasonal variations of phytoplankton and zooplankton communities as indicated by Non-Metric Multidimensional scaling (NMDS) methods. Also, Redundancy Analysis (RDA) demonstrated that environmental indicators together accounted for 25.6% and 50.1% variance of phytoplankton and zooplankton, respectively, indicating that environmental variations affected significantly on the temporal dynamics of phytoplankton as well as zooplankton communities. What's more, variance partioning suggested that the major environmental factors influencing variation structures of zooplankton communities were water temperature, concentration of nitrogen, revealing the dominating driving mechanism which shaped the communities of zooplankton. It was also found that there was significant synchronization between zooplankton biomass and phytoplankton biomass (expressed as Chl-a concentration), which suggested that zooplankton respond to changes in dynamic structure of phytoplankton community and can initiate a decrease in phytoplankton biomass through grazing in a few months.",G19-89001,1050-1057,10.1016/j.envpol.2018.11.007,Li-2019-Temporal
How Much Information Is Required to Well Constrain Local Estimates of Future Precipitation Extremes?,"Chao Li, Francis Zwiers, Xuebin Zhang, Guilong Li, ",,G19-90001,11-24,10.1029/2018ef001001,Li-2019-How
Larger Increases in More Extreme Local Precipitation Events as Climate Warms,"Chao Li, Francis Zwiers, Xuebin Zhang, Gang Chen, Jian Lu, Guilong Li, Jesse Norris, Yaheng Tan, Ying Sun, Min Liu, ",,G19-91001,6885-6891,10.1029/2019gl082908,Li-2019-Larger
"Sedimentary DNA reveals over 150 years of ecosystem change by human activities in Lake Chao, China","Feilong Li, Xiaowei Zhang, Yuwei Xie, Jizhong Wang, ","Understanding the extent and directionality of the impact of human activities on ecosystems is directly related to their management and protection. However, the lack of historical data limits our understanding of ecosystem changes with long-term exposure to human activities. Recently, lake sedimentary DNA (sedDNA) has become a powerful tool for revealing changes in ecosystems at the century and millennium scales. Here, we used sedDNA to reveal the dynamic of the microbial community (including bacteria and micro-eukaryotes) in Lake Chao over the past 150 years, and further explored the effects of long-term nutrient and heavy metal loads on these communities. Our data show that nutrient and heavy metal loads in Lake Chao have increased by ca. 2 to 4-fold since the 1960s. In response, the community structure, diversity, and ecological network of bacteria and micro-eukaryotes changed significantly during the 1960s, the 1980s and the 2010s. Importantly, community structure was more sensitive to human activities than diversity. We also found that the relative abundance of some taxa associated with nitrification and algal blooms (e.g., taxa in Nitrospira sp., Peridinales) has increased ca. 100-fold since the 1960s. Nutrient could better explain the variation in the bacterial community (ca. twice as much as heavy metal), while heavy metal explained micro-eukaryotes better (ca. 3 or 5-fold as much as nutrient). In particular, based on parsimonious models from distance-based linear model (distLM), we further identified that Pb is the key factor affecting the bacterial and micro-eukaryotes community in Lake Chao in addition to nutrient. Our study reveals the impacts of long-term human activities on lake ecosystems from multiple perspectives of nutrient and heavy metal loads, community structure, diversity and ecological network, these findings will contribute to the management and conservation of lakes in the future.",G19-92001,105214,10.1016/j.envint.2019.105214,Li-2019-Sedimentary
"Intercomparison of Multiple Hydroclimatic Datasets across the Lower Nelson River Basin, Manitoba, Canada","Rajtantra Lilhare, Stephen J. Déry, Scott Pokorny, Tricia A. Stadnyk, Kristina A. Koenig, ",ABSTRACTThis study evaluates the 1981–2010 spatiotemporal differences in six available climate datasets (daily total precipitation and mean air temperature) over the Lower Nelson River Basin (LNRB)...,G19-93001,262-278,10.1080/07055900.2019.1638226,Lilhare-2019-Intercomparison
Radar Scatter Decomposition to Differentiate between Running Ice Accumulations and Intact Ice Covers along Rivers,"Karl–Erich Lindenschmidt, Zhaoqin Li, ","For ice-jam flood forecasting it is important to differentiate between intact ice covers and ice runs. Ice runs consist of long accumulations of rubble ice that stem from broken up ice covers or ice-jams that have released. A water wave generally travels ahead of the ice run at a faster celerity, arriving at the potentially high flood–risk area much sooner than the ice accumulation. Hence, a rapid detection of the ice run is necessary to lengthen response times for flood mitigation. Intact ice covers are stationary and hence are not an immediate threat to a downstream flood situation, allowing more time for flood preparedness. However, once ice accumulations are moving and potentially pose imminent impacts to flooding, flood response may have to switch from a mitigation to an evacuation mode of the flood management plan. Ice runs are generally observed, often by chance, through ground observations or airborne surveys. In this technical note, we introduce a novel method of differentiating ice runs from intact ice covers using imagery acquired from space-borne radar backscatter signals. The signals are decomposed into different scatter components—surface scattering, volume scattering and double-bounce—the ratios of one to another allow differentiation between intact and running ice. The method is demonstrated for the breakup season of spring 2018 along the Athabasca River, when an ice run shoved into an intact ice cover which led to some flooding in Fort McMurray, Alberta, Canada.",G19-94001,307,10.3390/rs11030307,Lindenschmidt-2019-Radar
