title,author,abstract,url,pages,doi,bibkey
"Agricultural Water Quality in Cold Climates: Processes, Drivers, Management Options, and Research Needs","Jian Liu, Helen M. Baulch, Merrin L. Macrae, Henry F. Wilson, Jane A. Elliott, Lars Bergström, Aaron J. Glenn, Peter A. Vadas, ","Cold agricultural regions are important sites of global food production. This has contributed to widespread water quality degradation influenced by processes and hydrologic pathways that differ from warm region analogues. In cold regions, snowmelt is often a dominant period of nutrient loss. Freeze-thaw processes contribute to nutrient mobilization. Frozen ground can limit infiltration and interaction with soils, and minimal nutrient uptake during the nongrowing season may govern nutrient export from agricultural catchments. This paper reviews agronomic, biogeochemical, and hydrological characteristics of cold agricultural regions and synthesizes findings of 23 studies that are published in this special section, which provide new insights into nutrient cycling and hydrochemical processes, model developments, and the efficacy of different potentially beneficial management practices (BMPs) across varied cold regions. Growing evidence suggests the need to redefine optimum soil phosphorus levels and input regimes in cold regions to allow achievement of water quality targets while still supporting strong agricultural productivity. Practices should be considered through a regional and site-specific lens, due to potential interactions between climate, hydrology, vegetation, and soils, which influence the efficacy of nutrient, crop, water, and riparian buffer management. This leads to differing suitability of BMPs across varied cold agricultural regions. We propose a systematic approach (""""), to achieve water quality objectives in variable and changing climates, which combines nutrient transport process onceptualization, nderstanding BMP functions, redicting effects of variability and change, onsideration of producer input and agronomic and environmental tradeoffs, practice daptation, nowledge mobilization, and valuation of water quality improvement.",G19-36004,792-802,10.2134/jeq2019.05.0220,Liu-2019-Agricultural
Impacts of Soil Phosphorus Drawdown on Snowmelt and Rainfall Runoff Water Quality,"Jian Liu, Jane A. Elliott, Henry F. Wilson, Helen M. Baulch, ","Managing P export from agricultural land is critical to address freshwater eutrophication. However, soil P management, and options to draw down soil P have received little attention in snowmelt-dominated regions because of limited interaction between soil and snowmelt. Here, we assessed the impacts of soil P drawdown (reducing fertilizer P inputs combined with harvest removal) on soil Olsen P dynamics, runoff P concentrations, and crop yields from 1997 to 2014 in paired fields in Manitoba, Canada. We observed that Olsen P concentrations in the 0- to 5-cm soil layer were negatively correlated with the cumulative P depletion and declined rapidly at the onset of the drawdown practice (3.1 to 5.4 mg kg yr during 2007-2010). In both snowmelt runoff and rainfall runoff, concentrations of total dissolved P (TDP) were positively correlated with the concentrations of soil Olsen P. Soil P drawdown to low to moderate fertility levels significantly decreased mean annual flow-weighted TDP concentrations in snowmelt runoff from 0.60 to 0.30 mg L in the field with high initial soil P and from 1.17 to 0.42 mg L in the field with very high initial soil P. Declines in TDP concentration in rainfall runoff were greater. Critically, yields of wheat ( spp.) and canola ( L.) were not affected by soil P depletion. In conclusion, we demonstrate that relatively rapid reductions in P loads are achievable at the field scale via managing P inputs and soil P pools, highlighting a management opportunity that can maintain food security while improving water security in cold regions.",G19-36005,803-812,10.2134/jeq2018.12.0437,Liu-2019-Impacts
Impacts of Cover Crops and Crop Residues on Phosphorus Losses in Cold Climates: A Review,"Jian Liu, Merrin L. Macrae, Jane A. Elliott, Helen M. Baulch, Henry F. Wilson, Peter J.A. Kleinman, ","The use of cover crops and crop residues is a common strategy to mitigate sediment and nutrient losses from land to water. In cold climates, elevated dissolved P losses can occur associated with freeze-thaw of plant materials. Here, we review the impacts of cover crops and crop residues on dissolved P and total P loss in cold climates across ∼41 studies, exploring linkages between water-extractable P (WEP) in plant materials and P loss in surface runoff and subsurface drainage. Water-extractable P concentrations are influenced by plant type and freezing regimes. For example, WEP was greater in brassica cover crops than in non-brassicas, and increased with repeated freeze-thaw cycles. However, total P losses in surface runoff and subsurface drainage from cropped fields under cold climates were much lower than plant WEP, owing to retention of 45 to >99% of released P by soil. In cold climatic regions, cover crops and crop residues generally prevented soil erosion and loss of particle-bound P during nongrowing seasons in erodible landscapes but tended to elevate dissolved P loss in nonerodible soils. Their impact on total P loss was inconsistent across studies and complicated by soil, climate, and management factors. More research is needed to understand interactions between these factors and plant type that influence P loss, and to improve the assessment of crop contributions to P loss in field settings in cold climates. Further, tradeoffs between P loss and the control of sediment loss and N leaching by plants should be acknowledged.",G19-36006,850-868,10.2134/jeq2019.03.0119,Liu-Macrae-2019-Impacts-of
"Agricultural Edge‐of‐Field Phosphorus Losses in Ontario, Canada: Importance of the Nongrowing Season in Cold Regions","Janina Plach, Will Pluer, Merrin Macrae, Mazda Kompanizare, Kevin McKague, Ryan Carlow, Richard Brunke, ","Agricultural P losses are a global economic and water quality concern. Much of the current understanding of P dynamics in agricultural systems has been obtained from rainfall-driven runoff, and less is known about cold-season processes. An improved understanding of the magnitude, form, and transport flow paths of P losses from agricultural croplands year round, and the climatic drivers of these processes, is needed to prioritize and evaluate appropriate best management practices (BMPs) to protect soil-water quality in cold regions. This study examines multiyear, year-round, high-frequency edge-of-field P losses (soluble reactive P and total P [TP]) in overland flow and tile drainage from three croplands in southern Ontario, Canada. Annual and seasonal budgets for water, P, and estimates of field P budgets (including fertilizer inputs, crop uptake, and runoff) were calculated for each site. Annual edge-of-field TP loads ranged from 0.18 to 1.93 kg ha yr (mean = 0.59 kg ha yr) across the region, including years with fertilizer application. Tile drainage dominated runoff across sites, whereas the contribution of tiles and overland flow to P loss differed regionally, likely related to site-specific topography, soil type, and microclimate. The nongrowing season was the dominant period for runoff and P loss across sites, where TP loss during this period was often associated with overland flow during snowmelt. These results indicate that emphasis should be placed on BMPs that are effective during both the growing and nongrowing season in cold regions, but that the suitability of various BMPs may vary for different sites.",G19-36007,813-821,10.2134/jeq2018.11.0418,Plach-2019-Agricultural
Seasonality of Phosphorus and Nitrate Retention in Riparian Buffers,"Sanjayan Satchithanantham, Blair English, Henry Wilson, ","Measurement of the retention of dissolved nutrients in riparian areas with snowmelt runoff are much less common than for rainfall runoff, but low rates of uptake or the release of nutrients with snowmelt have been attributed to frozen soils, lower biotic uptake, and release of nutrients from senesced vegetation. In the research presented here, we evaluate whether the potential for uptake of dissolved reactive phosphorus (DRP) and NO differ significantly between snowmelt and summer seasons with flow through 13 riparian buffers downstream of cropland in Manitoba, Canada. Flow-through buffers in small channels are typical in this landscape, and pulsed releases of a conservative tracer and dissolved nutrients were used to measure uptake rates. Although mean uptake rates of NO were higher in summer than for snowmelt, responses varied widely. Aerial uptake rate of DRP showed a significant negative relationships with soil Olsen-P ( = 0.54, < 0.001) and a P saturation index ( = 0.48, < 0.001) across both seasons. Biological processes may be of greater importance for NO retention, but DRP retention appears to be driven by adsorption-desorption regardless of season. Olsen-P is identified as a good indicator of potential for release or retention of DRP in riparian buffers with fine-textured calcareous soils, for both snowmelt and summer seasons. Soil testing may be a good tool to aid in the siting of new buffers and to track the effectiveness of management interventions to remove P from riparian areas, such as harvest of vegetation.",G19-36008,915-921,10.2134/jeq2018.07.0280,Satchithanantham-2019-Seasonality
Nutrient Loss in Snowmelt Runoff: Results from a Long‐term Study in a Dryland Cropping System,"Kimberley D. Schneider, Brian G. McConkey, Arumugam Thiagarajan, Jane A. Elliott, D. Keith Reid, ","Snowmelt runoff often comprises the majority of annual runoff in the Canadian Prairies and a significant proportion of total nutrient loss from agricultural land to surface water. Our objective was to determine the effect of agroecosystem management on snowmelt runoff and nutrient losses from a long-term field experiment at Swift Current, SK. Runoff quantity, nutrient concentrations, and loads were estimated after a change in management from conventionally tilled wheat ( L.)-fallow (Conv W-F) to no-till wheat-fallow and subsequently no-till wheat-pulse (NT W-F/LP) and to an organic system with a wheat-green manure rotation (Org W-GM). The conversion from conventional tillage practices to no-till increased snowmelt runoff likely due to snow trapping by standing stubble after summer fallow. Relatedly, runoff after no-till summer fallow had higher dissolved P losses (0.07 kg P ha). Replacing summer fallow with a pulse crop in the no-till rotation decreased snowmelt runoff losses and nutrient concentrations. The Org W-GM treatment had the lowest P loss after stubble (0.02 kg P ha) but had high dissolved P concentrations in snowmelt following the green manure (0.55 mg P L), suggesting a contribution from incorporated crop residues. In this semiarid climate with little runoff, dissolved reactive P and NO-N loads in snowmelt runoff were smaller than those reported elsewhere on the prairies (averaging <0.05 kg P ha yr, and <0.2 kg NO-N ha yr); however, the nutrient concentrations we observed, in particular for P, even without P fertilizer addition for organic production, question the practicality of agricultural management systems in this region meeting water quality guidelines.",G19-36009,831-840,10.2134/jeq2018.12.0448,Schneider-2019-Nutrient
Landscape Controls on Nutrient Export during Snowmelt and an Extreme Rainfall Runoff Event in Northern Agricultural Watersheds,"Henry F. Wilson, Nora J. Casson, Aaron J. Glenn, Pascal Badiou, Lyle Boychuk, ","In the northern Great Plains, most runoff transport of N, and P to surface waters has historically occurred with snowmelt. In recent years, significant rainfall runoff events have become more frequent and intense in the region. Here, we examine the influence of landscape characteristics on hydrology and nutrient export in nine tributary watersheds of the Assiniboine River in Manitoba, Canada, during snowmelt runoff and with an early summer extreme rainfall runoff event (ERRE). All watersheds included in the study have land use that is primarily agricultural, but with differing proportions of land remaining as wetlands, grassland, and that has been artificially drained. Those watersheds with greater capacity for storage of water in surface depressions (noneffective contributing areas) exhibited lower rates of runoff and nutrient export with snowmelt. During the ERRE, higher export of total P (TP), but not total N, was observed from those watersheds with larger amounts of contributing area that had been added through artificial surface drainage, and this was associated primarily with higher TP concentrations. Increasing or restoring the storage of water on the landscape is likely to reduce nutrient export; however, the importance of antecedent conditions was evident during the ERRE, when small surface depressions were at or near capacity from snowmelt. Total P concentrations observed during the summer ERRE were as high as those observed with snowmelt, and N/P ratios were significantly lower. If the frequency of summer ERREs increases with climate change, this is likely to result in negative water quality outcomes.",G19-36010,841-849,10.2134/jeq2018.07.0278,Wilson-2019-Landscape
Near‐Surface Soils as a Source of Phosphorus in Snowmelt Runoff from Cropland,"Henry Wilson, Jane Elliott, Merrin Macrae, Aaron Glenn, ","In northern regions, a high proportion of annual runoff and phosphorus (P) export from cropland occurs with snowmelt. In this study, we analyze 57 site-years of field-scale snowmelt runoff data from 16 small watersheds draining fine-textured soils (clay or clay loam) in Manitoba, Canada. These fields were selected across gradients of soil P (2.4 to 26.7 mg kg, 0- to 15-cm Olsen P), tillage intensity (high frequency to long-term no-till), and fertilizer input. The strongest predictor of flow-weighted mean concentrations of total dissolved P (TDP) in snowmelt runoff was Olsen P in the top 5 cm of soil ( = 0.45, < 0.01). Residual variation in this relationship related positively to volumetric soil moisture and negatively to water yield. Although Olsen P levels were relatively consistent from year to year, suggesting control by long-term fertilization and tillage history, Olsen P stratification (ratio of 0-5/0-15 cm) increased with rates of fertilizer application. Particulate P (PP) comprised <34% of total P on average, and concentrations were not well predicted by soil or management characteristics. Loads of PP and TDP exported during snowmelt were primarily a function of water yield and size of accumulated snowpack; however, residual variation in the TDP relationship correlated positively with both soil moisture and Olsen P. Retention of runoff water on the landscape could reduce loads, but careful management of near-surface soil P is required to prevent snowmelt runoff losses of P at the source and to reduce the potential for the eutrophication of downstream aquatic ecosystems.",G19-36011,921-930,10.2134/jeq2019.04.0155,Wilson-2019-Near‐Surface
Atmospheric circulation amplifies shift of winter streamflow in southern Ontario,"Olivier Champagne, M. Altaf Arain, Paulin Coulibaly, ","Abstract Flooding is a major concern for Canadian society as it is the costliest natural disaster type in Canada. Southern Ontario, which houses one-third of the Canadian population, is located in an area of high vulnerability for floods. The most significant floods in the region have historically occurred during the months of March and April due to snowmelt coupled with extreme rain events. However, during the last three decades, there has been a shift of flooding events to earlier months. The aim of this study was to understand the impacts of atmospheric circulation on the temporal shift of streamflow and high flow events observed in southern Ontario over 1957–2013 period. Predominant weather regimes over North America, corresponding to recurrent meteorological situations, were identified using a discretization of daily geopotential height at 500HpA level (Z500). A regime-normalized hypothetical temperature and precipitation dataset was constructed to quantify the contribution of atmospheric circulation on streamflow response. The hypothetical dataset was used as input in the Precipitation Runoff Modeling System (PRMS), a rainfall-runoff semi-distributed hydrological model, and applied to four watersheds in southern Ontario. The results showed an increase in the temporal frequency of the regime identified here as High Pressure (HP) close to eight occurrences per decade. Regime HP, characterized by a northern position of the polar vortex, is correlated with a positive phase of the NAO and is associated with warm and wet conditions over southern Ontario during winter. The temporal increase in HP contributed more than 40% of the increase in streamflow in winter and 30–45% decrease in streamflow in April. This atmospheric situation also contributed to increase the number of high flows by 25–50% in January. These results are important to improve the seasonal forecasting of high flows and to assess the uncertainty in the temporal evolution of streamflow in the Great Lakes region.",G19-37001,124051,10.1016/j.jhydrol.2019.124051,Champagne-2019-Atmospheric
Asymmetric Response of Land Storage to ENSO Phase and Duration,"Hrishikesh A. Chandanpurkar, John T. Fasullo, John T. Reager, Robert S. Nerem, James S. Famiglietti, ","Emergence of global mean sea level (GMSL) from a ‘hiatus’ following a persistent La Niña highlights the need to understand the causes of interannual variability in GMSL. Several studies link interannual variability in GMSL to anomalous transport of water mass between land and ocean—and subsequent changes in water storage in these reservoirs—primarily driven by El Niño/Southern Oscillation (ENSO). Despite this, asymmetries in teleconnections between ENSO mode and land water storage have received less attention. We use historical simulations of natural climate variability to characterize asymmetries in the hydrological response to ENSO based on phase and duration. Findings indicate pronounced phase-specific and duration-specific asymmetries covering up to 93 and 50 million km2 land area, respectively. The asymmetries are seasonally dependent, and based on the mean regional climate are capable of influencing inherently bounded storage by pushing the storage-precipitation relationship towards nonlinearity. The nonlinearities are more pronounced in dry regions in the dry season, wet regions in the wet season, and during Year 2 of persistent ENSO events, limiting the magnitude of associated anomalies under persistent ENSO influence. The findings have implications for a range of stakeholders, including sea level researchers and water managers.",G19-38001,2249,10.3390/w11112249,Chandanpurkar-2019-Asymmetric
How Do Modeling Decisions Affect the Spread Among Hydrologic Climate Change Projections? Exploring a Large Ensemble of Simulations Across a Diversity of Hydroclimates,"Oriana S. Chegwidden, Bart Nijssen, David E. Rupp, Jeffrey R. Arnold, Martyn P. Clark, Joseph J. Hamman, Shih‐Chieh Kao, Yixin Mao, Naoki Mizukami, Philip W. Mote, Ming Pan, Erik Pytlak, Mu Xiao, ",,G19-39001,623-637,10.1029/2018ef001047,Chegwidden-2019-How
Using 4-km WRF CONUS simulations to assess impacts of the surface coupling strength on regional climate simulation,"Liang Chen, Yanping Li, Fei Chen, Michael Barlage, Zhe Zhang, Zhenhua Li, ",,G19-40001,6397-6416,10.1007/s00382-019-04932-9,Chen-2019-Using
Parameterization of the Bulk Liquid Fraction on Mixed-Phase Particles in the Predicted Particle Properties (P3) Scheme: Description and Idealized Simulations,"Mélissa Cholette, Hugh Morrison, Jason A. Milbrandt, Julie M. Thériault, ","Abstract Bulk microphysics parameterizations that are used to represent clouds and precipitation usually allow only solid and liquid hydrometeors. Predicting the bulk liquid fraction on ice allows an explicit representation of mixed-phase particles and various precipitation types, such as wet snow and ice pellets. In this paper, an approach for the representation of the bulk liquid fraction into the predicted particle properties (P3) microphysics scheme is proposed and described. Solid-phase microphysical processes, such as melting and sublimation, have been modified to account for the liquid component. New processes, such as refreezing and condensation of the liquid portion of mixed-phase particles, have been added to the parameterization. Idealized simulations using a one-dimensional framework illustrate the overall behavior of the modified scheme. The proposed approach compares well to a Lagrangian benchmark model. Temperatures required for populations of ice crystals to melt completely also agree well with previous studies. The new processes of refreezing and condensation impact both the surface precipitation type and feedback between the temperature and the phase changes. Overall, prediction of the bulk liquid fraction allows an explicit description of new precipitation types, such as wet snow and ice pellets, and improves the representation of hydrometeor properties when the temperature is near 0°C.",G19-41001,561-582,10.1175/jas-d-18-0278.1,Cholette-2019-Parameterization
The initial three years of carbon dioxide exchange between the atmosphere and a reclaimed oil sand wetland,"M. Graham Clark, Elyn Humphreys, Sean K. Carey, ","Abstract Northern peatlands contain up to 20% of the ∼3000 Pg of global soil organic carbon. Carbon-rich peatlands cover upwards of 65% of the landscape in northern Canada where resource extraction activities disturb both the carbon pools and the future carbon sequestration capacity of the landscape. Previous estimates of the carbon losses from this disturbance predict a complete loss of the region’s peatland carbon pool. Mining industries operating in these sensitive environments have recently begun constructing closure landscapes which are intended to develop carbon cycle processes similar to undisturbed northern peatlands. This study investigates eddy covariance fluxes of carbon dioxide (CO2) at one of Canada’s first fully constructed boreal plains watersheds, the Sandhill Fen Watershed. During the first three years since inception, only the lowland region had an annual net ecosystem exchange of CO2 (NEE) indicative of increasing CO2 sink potential. The lowland region was characterized by saturated salvaged peat soils, standing water, thriving communities of Typha and Carex spp. and was a net CO2 sink of 77 g C m−2 in the third year. At the same time the upland and the midland regions characterized by moist salvaged peat soils and a mix of herbaceous, shrub and planted Picea glauca and Pinus banksiana remained net sources of CO2. Despite similar rates of gross primary production, ecosystem and plot-level respiration rates in the lowland were significantly lower than in the midland region, likely due to very low reduction potentials within the lowland’s saturated soils. With no other significant outflows of carbon, the lowland of the Sandhill Fen Watershed may be in the early stages of organic matter accumulation. Due to limited oxidation of the salvaged peat substrate in the lowland region, wetland reclamation employing these techniques may reduce the disturbance loss of the carbon pool in the boreal plains.",G19-42001,116-126,10.1016/j.ecoleng.2019.05.016,Clark-2019-The
Scientists’ warning on wildfire — a Canadian perspective,"Sean C.P. Coogan, François-Nicolas Robinne, Piyush Jain, Mike D. Flannigan, ","Recently, the World Scientists’ Warning to Humanity: a Second Notice was issued in response to ongoing and largely unabated environmental degradation due to anthropogenic activities. In the warning, humanity is urged to practice more environmentally sustainable alternatives to business as usual to avoid potentially catastrophic outcomes. Following the success of their warning, the Alliance of World Scientists called for discipline-specific follow-up papers. This paper is an answer to that call for the topic of wildland fire. Across much of Canada and the world, wildfires are anticipated to increase in severity and frequency in response to anthropogenic activities. The world scientists’ second warning provides the opportunity for wildland fire researchers to raise the profile of the potential impacts that anthropogenic activities are likely to have on future fire regimes and, in return, what impacts future fire regimes may have on humanity. We discuss how wildfire is related to several issues of concern raised in the world scientists’ second warning, including climate change, human population growth, biodiversity and forests, and freshwater availability. Furthermore, we touch on the potential future health impacts and challenges to wildfire suppression and management in Canada. In essence, our wildfire scientists’ warning to humanity is that we, as a society, will have to learn to live with more fire on the landscape. We provide some recommendations on how we might move forward to prepare for and adapt to future wildfire regimes in Canada. Although this paper is primarily Canadian in focus, the concepts and information herein also draw from international examples and are of relevance globally.",G19-43001,1015-1023,10.1139/cjfr-2019-0094,Coogan-2019-Scientists’
