title,author,abstract,url,pages,doi,bibkey
Conventional Oil—The Forgotten Part of the Water‐Energy Nexus,"Jennifer C. McIntosh, Grant Ferguson, ","The impacts of unconventional oil and gas production via high-volume hydraulic fracturing (HVHF) on water resources, such as water use, groundwater and surface water contamination, and disposal of produced waters, have received a great deal of attention over the past decade. Conventional oil and gas production (e.g., enhanced oil recovery [EOR]), which has been occurring for more than a century in some areas of North America, shares the same environmental concerns, but has received comparatively little attention. Here, we compare the amount of produced water versus saltwater disposal (SWD) and injection for EOR in several prolific hydrocarbon producing regions in the United States and Canada. The total volume of saline and fresh to brackish water injected into depleted oil fields and nonproductive formations is greater than the total volume of produced waters in most regions. The addition of fresh to brackish ""makeup"" water for EOR may account for the net gain of subsurface water. The total amount of water injected and produced for conventional oil and gas production is greater than that associated with HVHF and unconventional oil and gas production by well over a factor of 10. Reservoir pressure increases from EOR and SWD wells are low compared to injection of fluids for HVHF, however, the longer duration of injections could allow for greater solute transport distances and potential for contamination. Attention should be refocused from the subsurface environmental impacts of HVHF to the oil and gas industry as a whole.",G19-1001,669-677,10.1111/gwat.12917,McIntosh-2019-Conventional
Incorporating social dimensions in hydrological and water quality modeling to evaluate the effectiveness of agricultural beneficial management practices in a Prairie River Basin,"Lori Bradford, Anuja Thapa, Ashleigh Duffy, Elmira Hassanzadeh, Graham Strickert, Bram Noble, Karl-Erich Lindenschmidt, ",,G19-2001,14271-14287,10.1007/s11356-019-06325-1,Bradford-2019-Incorporating
"Risk Perception and Human Health Risk in Rural Communities Consuming Unregulated Well Water in Saskatchewan, Canada","Lorelei Ford, Cheryl Waldner, Javier Sanchez, Lalita Bharadwaj, ","Rural communities dependent on unregulated drinking water are potentially at increased health risk from exposure to contaminants. Perception of drinking water safety influences water consumption, exposure, and health risk. A community-based participatory approach and probabilistic Bayesian methods were applied to integrate risk perception in a holistic human health risk assessment. Tap water arsenic concentrations and risk perception data were collected from two Saskatchewan communities. Drinking water health standards were exceeded in 67% (51/76) of households in Rural Municipality #184 (RM184) and 56% (25/45) in Beardy's and Okemasis First Nation (BOFN). There was no association between the presence of a health exceedance and risk perception. Households in RM184 or with an annual income >$50,000 were most likely to have in-house water treatment. The probability of consuming tap water perceived as safe (92%) or not safe (0%) suggested that households in RM184 were unlikely to drink water perceived as not safe. The probability of drinking tap water perceived as safe (77%) or as not safe (11%) suggested households in BOFN contradicted their perception and consumed water perceived as unsafe. Integration of risk perception lowered the adult incremental lifetime cancer risk by 3% to 1.3 × 10-5 (95% CI 8.4 × 10-8 to 9.0 × 10-5 ) for RM184 and by 8.9 × 10-6 (95% CI 2.2 × 10-7 to 5.9 × 10-5 ) for BOFN. Probability of exposure to arsenic concentrations >1:100,000, negligible cancer risk, was 23% for RM184 and 22% for BOFN.",G19-3001,2559-2575,10.1111/risa.13335,Ford-2019-Risk
"“Spirit, Safety, and a Stand-off ”: The Research-Creation Process and Its Roles in Relationality and Reconciliation among Researcher and Indigenous Co-Learners in Saskatchewan, Canada","Myron Neapetung, Lori Bradford, Lalita Bharadwaj, ","Provision of safe water on reserves is an ongoing problem in Canada that can be addressed by mobilizing water knowledge across diverse platforms to a variety of audiences. A participatory artistic animation video on the lived experiences of Elderswith water in Yellow Quill First Nation, Treaty Four territory, was created to mobilize knowledge beyond conventional peer-review channels. Research findings from interviews with 22 Elders were translated through a collaborative process into a video with a storytelling format that harmonized narratives, visual arts, music, and meaningful symbols. Three themes emerged which centered on the spirituality of water, the survival need for water, and standoffs in water management. The translation process, engagement and video output were evaluated using an autoethnographic approach with two members of the research team. We demonstrate how the collaborative research process and co-created video enhance community-based participatory knowledge translation and sharing. We also express how the video augments First Nations community ownership, control, access and possession (OCAP) of research information that aligns with their storytelling traditions and does so in a youth-friendly, e-compatible form. Through the evaluative process we share lessons learned about the value and effectiveness of the video as a tool for fostering partnerships, and reconciliation. The benefits and positive impacts of the video for the Yellow Quill community and for community members are discussed.",G19-4001,37-60,10.15402/esj.v5i2.68334,"Neapetung-2019-“Spirit,"
Reclaiming Indigenous Planning as a Pathway to Local Water Security,"Robert J. Patrick, Kellie Grant, Lalita Bharadwaj, ","Access to drinkable water is essential to human life. The consequence of unsafe drinking water can be damaging to communities and catastrophic to human health. Today, one in five First Nation communities in Canada is on a boil water advisory, with some advisories lasting over 10 years. Factors contributing to this problem stretch back to colonial structures and institutional arrangement that reproduce woefully inadequate community drinking water systems. Notwithstanding these challenges, First Nation communities remain diligent, adaptive, and innovative in their efforts to provide drinkable water to their community members. One example is through the practice of source water protection planning. Source water is untreated water from groundwater or surface water that supplies drinking water for human consumption. Source water protection is operationalized through land and water planning activities aimed at reducing the risk of contamination from entering a public drinking water supply. Here, we introduce a source water protection planning process at Muskowekwan First Nation, Treaty 4, Saskatchewan. The planning process followed a community-based participatory approach guided by trust, respect, and reciprocity between community members and university researchers. Community members identified threats to the drinking water source followed by restorative land management actions to reduce those threats. The result of this process produced much more than a planning document but engaged multiple community members in a process of empowerment and self-determination. The process of plan-making produced many unintended results including human–land connectivity, reconnection with the water spirit, as well as the reclaiming of indigenous planning. Source water protection planning may not correct all the current water system inadequacies that exist on many First Nations, but it will empower communities to take action to protect their drinking water sources for future generations as a pathway to local water security.",G19-5001,936,10.3390/w11050936,Patrick-2019-Reclaiming
"“Garbage in, Garbage Out” Does Not Hold True for Indigenous Community Flood Extent Modeling in the Prairie Pothole Region","Anuja Thapa, Lori Bradford, Graham Strickert, Xiaolei Yu, Anthony Johnston, Kelsey Watson-Daniels, ","Extensive land use changes and uncertainties arising from climate change in recent years have contributed to increased flood magnitudes in the Canadian Prairies and threatened the vulnerabilities of many small and indigenous communities. There is, thus, a need to create modernized flood risk management tools to support small and rural communities’ preparations for future extreme events. In this study, we developed spatial flood information for an indigenous community in Central Saskatchewan using LiDAR based DEM and a spatial modeling tool, the wetland DEM ponding model (WDPM). A crucial element of flood mapping in this study was community engagement in data collection, scenario description for WDPM, and flood map validation. Community feedback was also used to evaluate the utility of the modelled flood outputs. The results showed the accuracy of WDPM outputs could be improved not only with the quality of DEM but also with additional community-held information on contributing areas (watershed information). Based on community feedback, this accessible, spatially-focused modeling approach can provide relevant information for community spatial planning and developing risk management strategies. Our study found community engagement to be valuable in flood modeling and mapping by: providing necessary data, validating input data through lived experiences, and providing alternate scenarios to be used in future work. This research demonstrates the suitability and utility of LiDAR and WDPM complemented by community participation for improving flood mapping in the Prairie Pothole Region (PPR). The approach used in the study also serves as an important guide for applying transdisciplinary tools and methods for establishing good practice in research and helping build resilient communities in the Prairies.",G19-6001,2486,10.3390/w11122486,Thapa-2019-“Garbage
Alpine Hydrogeology: The Critical Role of Groundwater in Sourcing the Headwaters of the World,"Masaki Hayashi, ","Groundwater discharge in alpine headwaters sustains baseflow in rivers originating in mountain ranges of the world, which is critically important for aquatic habitats, run-of-river hydropower generation, and downstream water supply. Groundwater storage in alpine watersheds was long considered negligible, but recent field-based studies have shown that aquifers are ubiquitous in the alpine zone with no soil and vegetation. Talus, moraine, and rock glacier aquifers are common in many alpine regions of the world, although bedrock aquifers occur in some geological settings. Alpine aquifers consisting of coarse sediments have a fast recession of discharge after the recharge season (e.g., snowmelt) or rainfall events, followed by a slow recession that sustains discharge over a long period. The two-phase recession is likely controlled by the internal structure of the aquifers. Spatial extent and distribution of individual aquifers determine the groundwater storage-discharge characteristics in first- and second-order watersheds in the alpine zone, which in turn govern baseflow characteristics in major rivers. Similar alpine landforms appear to have similar hydrogeological characteristics in many mountain ranges across the world, suggesting that a common conceptual framework can be used to understand alpine aquifers based on geological and geomorphological settings. Such a framework will be useful for parameterizing storage-discharge characteristics in large river hydrological models.",G19-7001,498-510,10.1111/gwat.12965,Hayashi-2019-Alpine
Biomic river restoration: A new focus for river management,"Matthew F. Johnson, Colin R. Thorne, Janine M. Castro, G. Mathias Kondolf, Celeste Searles Mazzacano, Stewart B. Rood, Cherie Westbrook, ",,G19-8001,3-12,10.1002/rra.3529,Johnson-2019-Biomic
"Spatially-distributed tracer-aided runoff modelling and dynamics of
storage and water ages in a permafrost-influenced catchment","Thea I. Piovano, Doerthe Tetzlaff, Sean K. Carey, Nadine J. Shatilla, Aaron Smith, Chris Soulsby, ","Abstract. Permafrost strongly controls hydrological processes in cold regions, and our understanding of how changes in seasonal and perennial frozen ground disposition and linked storage dynamics affects runoff generation processes remains limited. Storage dynamics and water redistribution are influenced by the seasonal variability and spatial heterogeneity of frozen ground, snow accumulation and melt. Stable isotopes provide a potentially useful technique to quantify the dynamics of water sources, flow paths and ages; yet few studies have employed isotope data in permafrost-influenced catchments. Here, we applied the conceptual model STARR (Spatially distributed Tracer-Aided Rainfall-Runoff model), which facilitates fully distributed simulations of hydrological storage dynamics and runoff processes, isotopic composition and water ages. We adapted this model to a subarctic catchment in Yukon Territory, Canada, with a time-variable implementation of field capacity to include the influence of thaw dynamics. A multi-criteria calibration based on stream flow, snow water equivalent and isotopes was applied to three years of data. The integration of isotope data in the spatially distributed model provided the basis to quantify spatio-temporal dynamics of water storage and ages, emphasizing the importance of thaw layer dynamics in mixing and damping the melt signal. By using the model conceptualisation of spatially and temporally variant storage, this study demonstrates the ability of tracer-aided modelling to capture thaw layer dynamics that cause mixing and damping of the isotopic melt signal.",G19-9001,,10.5194/hess-2019-59,Piovano-2019-Spatially-distributed
Wildland fire impacts on water yield across the contiguous United States,"Dennis Hallema, Ge Sun, Peter Caldwell, Francois-Nicolas Robinne, Kevin D. Bladon, Steve Norman, Yongqiang Liu, Erika C. Cohen, Steve McNulty, ",,G19-9002,,10.2737/srs-gtr-238,Hallema-2019-Wildland
Successful forecasting of harmful cyanobacteria blooms with high frequency lake data,"M.J. Kehoe, B.P. Ingalls, J.J. Venkiteswaran, H.M. Baulch, ","Abstract Cyanobacterial blooms are causing increasing issues across the globe. Bloom forecasting can facilitate adaptation to blooms. Most bloom forecasting models depend on weekly or fortnightly sampling, but these sparse measurements can miss important dynamics. Here we develop forecasting models from five years of high frequency summer monitoring in a shallow lake (which serves as an important regional water supply). A suite of models were calibrated to predict cyanobacterial fluorescence (a biomass proxy) using measurements of: cyanobacterial fluorescence, water temperature, light, and wind speed. High temporal autocorrelation contributed to relatively strong predictive power over 1, 4 and 7 day intervals. Higher order derivatives of water temperature helped improve forecasting accuracy. While traditional monitoring and modelling have supported forecasting on longer timescales, we show high frequency monitoring combined with telemetry allows forecasting over timescales of 1 day to 1 week, supporting early warning, enhanced monitoring, and adaptation of water treatment processes.",G19-9003,,10.1101/674325,Kehoe-2019-Successful
Extreme rainfall drives early onset cyanobacterial bloom,"Megan L. Larsen, Helen M. Baulch, Sherry L. Schiff, Dana F. Simon, Sébastien Sauvé, Jason J. Venkiteswaran, ","Abstract The increasing prevalence of cyanobacteria-dominated harmful algal blooms is strongly associated with nutrient loading and changing climatic patterns. Changes to precipitation frequency and intensity, as predicted by current climate models, are likely to affect bloom development and composition through changes in nutrient fluxes and water column mixing. However, few studies have directly documented the effects of extreme precipitation events on cyanobacterial composition, biomass, and toxin production. We tracked changes in a eutrophic reservoir following an extreme precipitation event, describing an atypically early toxin-producing cyanobacterial bloom, successional progression of the phytoplankton community, toxins, and geochemistry. An increase in bioavailable phosphorus by more than 27-fold in surface waters preceded notable increases in Aphanizomenon flos-aquae throughout the reservoir approximately 2 weeks post flood and ~5 weeks before blooms typically occur. Anabaenopeptin-A and three microcystin congeners (microcystin-LR, -YR, and -RR) were detected at varying levels across sites during the bloom period, which lasted between 3 and 5 weeks. Synthesis and applications: These findings suggest extreme rainfall can trigger early cyanobacterial bloom initiation, effectively elongating the bloom season period of potential toxicity. However, effects will vary depending on factors including the timing of rainfall and reservoir physical structure. In contrast to the effects of early season extreme rainfall, a mid-summer runoff event appeared to help mitigate the bloom in some areas of the reservoir by increasing flushing.",G19-9004,,10.1101/570275,Larsen-2019-Extreme
High-Resolution Regional Climate Modeling and Projection over Western Canada  using a Weather Research Forecasting Model with a Pseudo-Global Warming Approach,"Yanping Li, Zhenhua Li, Zhe Zhang, Liang Chen, Sopan Kurkute, Lucia Scaff, Xicai Pan, ","Abstract. To assess the hydroclimatic risks posed by climate change in western Canada, this study conducted a retrospective simulation (CTL) and a pseudo-global warming (PGW) dynamical downscaling of future warming projection under RCP8.5 from an ensemble of CMIP5 climate model projections using a convection-permitting 4-km Weather Research Forecasting (WRF) model. The convection-permitting resolution of the model avoids the error-prone convection parameterization by explicitly resolving cumulus plumes. The evaluation of surface air temperature by the retrospective simulation WRF-CTL against a gridded observation ANUSPLIN shows that WRF simulation of daily mean temperature agrees well with ANUSPLIN temperature in terms of the geographical distribution of cold biases east of the Canadian Rockies, especially in spring. Compared with the observed precipitation from ANUSPLIN and CaPA, the WRF-CTL simulation captures the main pattern of distribution, but with a wet bias seen in higher precipitation near the British Columbia coast in winter and over the immediate region on the lee side of the Canadian Rockies. The PGW simulation shows more warming than CTL, especially over the polar region in the northeast, during the cold season, and in daily minimum temperature. Precipitation changes in PGW over CTL vary with the seasons: In spring and late fall for both basins, precipitation is shown to increase, whereas in summer in the Saskatchewan River Basin, it either shows no increase or decreases, with less summer precipitation shown in PGW than in CTL for some parts of the Prairies. This seasonal difference in precipitation change suggests that in summer the Canadian Prairies and the southern Boreal Forest biomes will likely see a slight decline in precipitation minus evapotranspiration, which might impact soil moisture for farming and forest fires. With almost no increase in summer precipitation and much more evapotranspiration in PGW than in CTL, the water availability during the growing season will be challenging for the Canadian Prairies. WRF-PGW shows an increase of high-intensity precipitation events and shifts the distribution of precipitation events toward more extremely intensive events in all seasons, as current moderate events become extreme events with more vapor loading, especially in summer. Due to this shift in precipitation intensity to the higher end in the PGW simulation, the seemingly moderate increase in the total amount of precipitation in summer for both the Mackenzie and Saskatchewan river basins may not reflect the real change in flooding risk and water availability for agriculture. The high-resolution downscaled climate simulations provide abundant opportunities both for investigating local-scale atmospheric dynamics and for studying climate impacts in hydrology, agriculture, and ecosystems. The change in the probability distribution of precipitation intensity also calls for innovative bias-correction methods to be developed for the application of the dataset when bias-correction is required.",G19-9005,,10.5194/hess-2019-201,Li-2019-High-Resolution
"Are the effects of vegetation and soil changes as important as climate
change impacts on hydrological processes?","Kabir Rasouli, John W. Pomeroy, Paul H. Whitfield, ","Abstract. Hydrological processes are widely understood to be sensitive to changes in climate, but the effects of changes in vegetation and soils have seldom been considered. The response of mountain hydrology to future climate and vegetation/soil changes is modelled in three snowmelt dominated mountain basins in the North American Cordillera. A Cold Regions Hydrological Model developed for each basin was driven with perturbed observed meteorological time series. Monthly perturbations were developed from differences in eleven regional climate model outputs between the present and future scenarios. Future climate change in these basins results in decreased modelled peak snow water equivalent (SWE) but increased evapotranspiration in all basins. All three watersheds became more rainfall-dominated. In Wolf Creek in the Yukon Territory, an insignificant increasing effect of vegetation change on peak SWE was found to be important enough to offset the significant climate change effect on alpine snow. In Marmot Creek in the Canadian Rockies, a combined effect of soil and climate changes on increasing annual runoff becomes significant while their individual effects are not statistically significant. In the relatively warmer Reynolds Mountain East catchment in Idaho, USA, only vegetation change decreases annual runoff volume and changes in soil, climate, or combination of them do not affect runoff. At high elevations in Wolf and Marmot Creeks, modelled vegetation/soil changes moderated the impact of climate change on peak SWE, the timing of peak SWE, evapotranspiration, and annual runoff volume. At medium elevations, these changes intensified the impact of climate change, decreasing peak SWE, and sublimation. The modelled hydrological impacts of changes in climate, vegetation, and soil in mountain environments are similar in magnitude but not consistently in the direction in all biomes; in some combinations, this results in enhanced impacts at lower elevations and latitudes and offsetting effects at higher elevations and latitudes.",G19-9006,,10.5194/hess-2019-214,Rasouli-2019-Are
"Hydrologic-Land Surface Modelling of a Complex System under Precipitation
Uncertainty: A Case Study of the Saskatchewan River Basin, Canada","Fuad Yassin, Saman Razavi, Jefferson S. Wong, Alain Pietroniro, Howard Wheater, ","Abstract. Hydrologic-Land Surface Models (H-LSMs) have been progressively developed to a stage where they represent the dominant hydrological processes for a variety of hydrological regimes and include a range of water management practices, and are increasingly used to simulate water storages and fluxes of large basins under changing environmental conditions across the globe. However, efforts for comprehensive evaluation of the utility of H-LSMs in large, regulated watersheds have been limited. In this study, we evaluated the capability of a Canadian H-LSM, called MESH, in the highly regulated Saskatchewan River Basin (SaskRB), Canada, under the constraint of significant precipitation uncertainty. The SaskRB is a complex system characterized by hydrologically-distinct regions that include the Rocky Mountains, Boreal Forest, and the Prairies. This basin is highly vulnerable to potential climate change and extreme events. A comprehensive analysis of the MESH model performance was carried out in two steps. First, the reliability of multiple precipitation products was evaluated against climate station observations and based on their performance in simulating streamflow across the basin when forcing the MESH model with a default parameterization. Second, a state-of-the-art multi-criteria calibration approach was applied, using various observational information including streamflow, storage and fluxes for calibration and validation. The first analysis shows that the quality of precipitation products had a direct and immediate impact on simulation performance for the basin headwaters but effects were dampened when going downstream. In particular, the Canadian Precipitation Analysis (CaPA) performed the best among the precipitation products in capturing timings and minimizing the magnitude of error against observation, despite a general underestimation of precipitation amount. The subsequent analyses show that the MESH model was able to capture observed responses of multiple fluxes and storage across the basin using a global multi-station calibration method. Despite poorer performance in some basins, the global parameterization generally achieved better model performance than a default model parameterization. Validation using storage anomaly and evapotranspiration generally showed strong correlation with observations, but revealed potential deficiencies in the simulation of storage anomaly over open water areas.",G19-9007,,10.5194/hess-2019-207,Yassin-2019-Hydrologic-Land
