title,author,abstract,url,pages,doi,bibkey
Spatially distributed tracer-aided runoff modelling and dynamics of storage and water ages in a permafrost-influenced catchment,"Thea I. Piovano, Doerthe Tetzlaff, Sean K. Carey, Nadine J. Shatilla, Aaron Smith, Chris Soulsby, ","Abstract. Permafrost strongly controls hydrological processes in cold regions. Our understanding of how changes in seasonal and perennial frozen ground disposition and linked storage dynamics affect runoff generation processes remains limited. Storage dynamics and water redistribution are influenced by the seasonal variability and spatial heterogeneity of frozen ground, snow accumulation and melt. Stable isotopes are potentially useful for quantifying the dynamics of water sources, flow paths and ages, yet few studies have employed isotope data in permafrost-influenced catchments. Here, we applied the conceptual model STARR (the Spatially distributed Tracer-Aided Rainfall–Runoff model), which facilitates fully distributed simulations of hydrological storage dynamics and runoff processes, isotopic composition and water ages. We adapted this model for a subarctic catchment in Yukon Territory, Canada, with a time-variable implementation of field capacity to include the influence of thaw dynamics. A multi-criteria calibration based on stream flow, snow water equivalent and isotopes was applied to 3 years of data. The integration of isotope data in the spatially distributed model provided the basis for quantifying spatio-temporal dynamics of water storage and ages, emphasizing the importance of thaw layer dynamics in mixing and damping the melt signal. By using the model conceptualization of spatially and temporally variable storage, this study demonstrates the ability of tracer-aided modelling to capture thaw layer dynamics that cause mixing and damping of the isotopic melt signal.",G19-119002,2507-2523,10.5194/hess-23-2507-2019,Piovano-2019-Spatially
Understanding and managing the re-eutrophication of Lake Erie: Knowledge gaps and research priorities,"Mohamed N. Mohamed, Christopher Wellen, Chris T. Parsons, William D. Taylor, George Arhonditsis, Krista M. Chomicki, Duncan Boyd, Paul Weidman, Scott O. C. Mundle, Philippe Van Cappellen, Andrew N. Sharpley, Douglas G. Haffner, ",AbstractEutrophication of freshwaters is already a problem in many regions globally and will probably worsen as human populations grow and consume more resources. The ability of researchers and gov...,G19-120001,675-691,10.1086/705915,Mohamed-2019-Understanding
Automatic Components Separation of Obfuscated Android Applications: An Empirical Study of Design Based Features,"Amit Kumar Mondal, Chanchal Roy, Banani Roy, Kevin A. Schneider, ","In modern days, mobile applications (apps) have become omnipresent. Components of mobile apps (such as 3rd party libraries) require to be separated and analyzed differently for security issue detection, repackaged app detection, tumor code purification and so on. Various techniques are available to automatically analyze mobile apps. However, analysis of the app's executable binary remains challenging due to required curated database, large codebases and obfuscation. Considering these, we focus on exploring a versatile technique to separate different components with design-based features independent of code obfuscation. Particularly, we conducted an empirical study using design patterns and fuzzy signatures to separate app components such as 3rd party libraries. In doing so, we built a system for automatically extracting design patterns from both the executable package (APK) and Jar of an Android application. The experimental results with various standard datasets containing 3rd party libraries, obfuscated apps and malwares reveal that design features like these are present significantly within them (within 60% APKs including malware). Moreover, these features remain unaltered even after app obfuscation. Finally, as a case study, we found that the design patterns alone can detect 3rd party libraries within the obfuscated apps considerably (F1 score is 32%). Overall, our empirical study reveals that design features might play a versatile role in separating various Android components for various purposes.",G19-121001,,10.1109/asew.2019.00022,Mondal-2019-Automatic
Clone-World: A visual analytic system for large scale software clones,"Debajyoti Mondal, Manishankar Mondal, Chanchal K. Roy, Kevin A. Schneider, Yukun Li, Shisong Wang, ","Abstract With the era of big data approaching, the number of software systems, their dependencies, as well as the complexity of the individual system is becoming larger and more intricate. Understanding these evolving software systems is thus a primary challenge for cost-effective software management and maintenance. In this paper we perform a case study with evolving code clones. The programmers often need to manually analyze the co-evolution of clone fragments to decide about refactoring, tracking, and bug removal. However, manual analysis is time consuming, and nearly infeasible for a large number of clones, e.g., with millions of similarity pairs, where clones are evolving over hundreds of software revisions. We propose an interactive visual analytics system, Clone-World, which leverages big data visualization approach to manage code clones in large software systems. Clone-World, gives an intuitive yet powerful solution to the clone analytic problems. Clone-World combines multiple information-linked zoomable views, where users can explore and analyze clones through interactive exploration in real time. User studies and experts’ reviews suggest that Clone-World may assist developers in many real-life software development and maintenance scenarios. We believe that Clone-World will ease the management and maintenance of clones, and inspire future innovation to adapt visual analytics to manage big software systems.",G19-122001,18-26,10.1016/j.visinf.2019.03.003,Mondal-2019-Clone-World:
An empirical study on bug propagation through code cloning,"Manishankar Mondal, Banani Roy, Chanchal K. Roy, Kevin A. Schneider, ","Abstract Code clones are identical or nearly similar code fragments in a code-base. According to the existing studies, code clones are directly related to bugs. Code cloning, creating code clones, is suspected to propagate temporarily hidden bugs from one code fragment to another. However, there is no study on the intensity of bug-propagation through code cloning. In this paper, we define two clone evolutionary patterns that reasonably indicate bug propagation through code cloning. By analyzing software evolution history, we identify those code clones that evolved following the bug propagation patterns. According to our study on thousands of commits of seven subject systems, overall 18.42% of the clone fragments that experience bug-fixes contain propagated bugs. Type-3 clones are primarily involved with bug-propagation. Bug propagation is more likely to occur in the clone fragments that are created in the same commit rather than in different commits. Moreover, code clones residing in the same file have a higher possibility of containing propagated bugs compared to those residing in different files. Severe bugs can sometimes get propagated through code cloning. Automatic support for immediately identifying occurrences of bug-propagation can be beneficial for software maintenance. Our findings are important for prioritizing code clones for management.",G19-123001,110407,10.1016/j.jss.2019.110407,Mondal-2019-An
Investigating Context Adaptation Bugs in Code Clones,"Manishankar Mondal, Banani Roy, Chanchal K. Roy, Kevin A. Schneider, ","The identical or nearly similar code fragments in a code-base are called code clones. There is a common belief that code cloning (copy/pasting code fragments) can introduce bugs in a software system if the copied code fragments are not properly adapted to their contexts (i.e., surrounding code). However, none of the existing studies have investigated whether such bugs are really present in code clones. We denote these bugs as Context Adaptation Bugs, or simply Context-Bugs, in our paper and investigate the extent to which they can be present in code clones. We define and automatically analyze two clone evolutionary patterns that indicate fixing of Context-Bugs. According to our analysis on thousands of revisions of six open-source subject systems written in Java, C, and C#, code cloning often introduces Context-Bugs in software systems. Around 50% of the clone related bug-fixes can occur for fixing Context-Bugs. Cloning (copy/pasting) a newly created code fragment (i.e., a code fragment that was not added in a former revision) is more likely to introduce Context-Bugs compared to cloning a preexisting fragment (i.e., a code fragment that was added in a former revision). Moreover, cloning across different files appears to have a significantly higher tendency of introducing Context-Bugs compared to cloning within the same file. Finally, Type 3 clones (gapped clones) have the highest tendency of containing Context-Bugs among the three major clone-types. Our findings can be important for early detection as well as removal of Context-Bugs in code clones.",G19-124001,,10.1109/icsme.2019.00026,Mondal-2019-Investigating
Replacing Mg<sup>2+</sup>by Fe<sup>2+</sup>for RNA‐Cleaving DNAzymes,"Woohyun J. Moon, Juewen Liu, ","It has been proposed that Mg2+ and Fe2+ are very similar in interacting with ribozymes and some protein-based enzymes, but their activities with DNAzymes have yet to be studied. Here, the activity of Fe2+ as cofactor for a few RNA-cleaving DNAzymes is investigated. 17E is a well-studied DNAzyme that is active in the presence of many different divalent metal ions; it is highly active with Fe2+ with an apparent Kd of 29.7±2.3 μm and a kobs of 1.12±0.11 min-1 in the presence of 1 mm Fe2+ at pH 7.5. Fe2+ has 21-fold higher activity than Mg2+ . Six different DNAzymes are then tested, and only the DNAzymes active with Mg2+ (17E, 8-17, and E5) are active with Fe2+ . Fe2+ has 25 and one- to twofold higher activity than Mg2+ for the 8-17 and E5 DNAzymes, respectively. In pH>7 buffer and in presence of air, 1 mm Fe2+ results in a nonspecific degradation of the DNA strand due to reactive oxygen species (ROS). Cleavage reactions in anoxic environment and antioxidant ascorbate can be used to overcome the effect of oxidation. The findings provide insights for potential DNAzyme catalysis in the early Earth, and they further support the similarity between Mg2+ and Fe2+ in enzyme catalysis.",G19-125001,401-407,10.1002/cbic.201900344,Moon-2019-Replacing
Changes in streamflow and water temperature affect fish habitat in the Athabasca River basin in the context of climate change,"L.A. Morales-Marín, P. Rokaya, P.R. Sanyal, J. Sereda, K.E. Lindenschmidt, ","• A physically-based semi-distributed hydrological model and a 1D stream water temperature model forced by climate change scenarios is presented here to analyze the effects of stream flow and water temperature changes on fish habitat in the Athabasca River catchment. • Streamflow decreases in most of the catchment will reduce flow velocities and water depths causing current Athabasca Rainbow Trout habitat to be suboptimal. • Increases in water temperature will result in habitat contraction concentrating Athabasca Rainbow Trout in the upper headwaters of the catchment. • Athabasca Rainbow Trout habitat can potentially be reduced as the frequency of occurrence of life threatening and lethal water temperatures tend to increase, particularly in summer. Changes to natural flow and air temperature in the context of climate change can have impacts on physiology, distribution and survival of fish. Of particular interest is the Athabasca River basin, a highly biologically productive basin that includes one of the largest boreal freshwater inland river deltas in the world and serves as habitat for many fish species. Earlier melt events, higher winter and spring flows and lower summer flows are expected as a consequence of climate change in this basin. Here, we model changes in river flow and water temperature under changing climate scenarios through the integration of a physically-based semi-distributed hydrological model and a 1D stream water temperature model forced by climate change scenarios. The modeled changes in streamflow and water temperature are used to predict changes in habitat suitability for the Athabasca Rainbow Trout (ART) ( Oncorhynchus mykiss ), a unique ecotype of trout considered as a ‘species at risk’. The results indicate that future flow decreases in most of the basin can lead to reduced flow velocities and water depths making current ART habitat suboptimal. Also, warming low-land habitats and increasing water temperatures will increase metabolic rates and stress fish forcing them to migrate upstream to cooler waters confining their habitat range.",G19-126001,108718,10.1016/j.ecolmodel.2019.108718,Morales-Marín-2019-Changes
Flood Risk Management in Canada’s Prairie Provinces: an Analysis of Decision-Maker Priorities and Policy Preferences,"Alasdair Morrison, Bram F. Noble, Cherie J. Westbrook, ",,G19-127001,608-625,10.1007/s00267-019-01208-0,Morrison-2019-Flood
Designing for Real-Time Groupware Systems to Support Complex Scientific Data Analysis,"Golam Mostaeen, Banani Roy, Chanchal Roy, Kevin Schneider, ","Scientific Workflow Management Systems (SWfMSs) have become popular for accelerating the specification, execution, visualization, and monitoring of data-intensive scientific experiments. Unfortunately, to the best of our knowledge no existing SWfMSs directly support collaboration. Data is increasing in complexity, dimensionality, and volume, and the efficient analysis of data often goes beyond the realm of an individual and requires collaboration with multiple researchers from varying domains. In this paper, we propose a groupware system architecture for data analysis that in addition to supporting collaboration, also incorporates features from SWfMSs to support modern data analysis processes. As a proof of concept for the proposed architecture we developed SciWorCS - a groupware system for scientific data analysis. We present two real-world use-cases: collaborative software repository analysis and bioinformatics data analysis. The results of the experiments evaluating the proposed system are promising. Our bioinformatics user study demonstrates that SciWorCS can leverage real-world data analysis tasks by supporting real-time collaboration among users.",G19-128001,1-28,10.1145/3331151,Mostaeen-2019-Designing
CloneCognition: machine learning based code clone validation tool,"Golam Mostaeen, Jeffrey Svajlenko, Banani Roy, Chanchal K. Roy, Kevin A. Schneider, ","A code clone is a pair of similar code fragments, within or between software systems. To detect each possible clone pair from a software system while handling the complex code structures, the clone detection tools undergo a lot of generalization of the original source codes. The generalization often results in returning code fragments that are only coincidentally similar and not considered clones by users, and hence requires manual validation of the reported possible clones by users which is often both time-consuming and challenging. In this paper, we propose a machine learning based tool 'CloneCognition' (Open Source Codes: https://github.com/pseudoPixels/CloneCognition ; Video Demonstration: https://www.youtube.com/watch?v=KYQjmdr8rsw) to automate the laborious manual validation process. The tool runs on top of any code clone detection tools to facilitate the clone validation process. The tool shows promising clone classification performance with an accuracy of up to 87.4%. The tool also exhibits significant improvement in the results when compared with state-of-the-art techniques for code clone validation.",G19-129001,,10.1145/3338906.3341182,Mostaeen-2019-CloneCognition:
CLCDSA: Cross Language Code Clone Detection using Syntactical Features and API Documentation,"Kawser Wazed Nafi, Tonny Shekha Kar, Banani Roy, Chanchal K. Roy, Kevin A. Schneider, ","Software clones are detrimental to software maintenance and evolution and as a result many clone detectors have been proposed. These tools target clone detection in software applications written in a single programming language. However, a software application may be written in different languages for different platforms to improve the application's platform compatibility and adoption by users of different platforms. Cross language clones (CLCs) introduce additional challenges when maintaining multi-platform applications and would likely go undetected using existing tools. In this paper, we propose CLCDSA, a cross language clone detector which can detect CLCs without extensive processing of the source code and without the need to generate an intermediate representation. The proposed CLCDSA model analyzes different syntactic features of source code across different programming languages to detect CLCs. To support large scale clone detection, the CLCDSA model uses an action filter based on cross language API call similarity to discard non-potential clones. The design methodology of CLCDSA is two-fold: (a) it detects CLCs on the fly by comparing the similarity of features, and (b) it uses a deep neural network based feature vector learning model to learn the features and detect CLCs. Early evaluation of the model observed an average precision, recall and F-measure score of 0.55, 0.86, and 0.64 respectively for the first phase and 0.61, 0.93, and 0.71 respectively for the second phase which indicates that CLCDSA outperforms all available models in detecting cross language clones.",G19-130001,,10.1109/ase.2019.00099,Nafi-2019-CLCDSA:
Learning from Examples to Find Fully Qualified Names of API Elements in Code Snippets,"C M Khaled Saifullah, Muhammad Asaduzzaman, Chanchal K. Roy, ","Developers often reuse code snippets from online forums, such as Stack Overflow, to learn API usages of software frameworks or libraries. These code snippets often contain ambiguous undeclared external references. Such external references make it difficult to learn and use those APIs correctly. In particular, reusing code snippets containing such ambiguous undeclared external references requires significant manual efforts and expertise to resolve them. Manually resolving fully qualified names (FQN) of API elements is a non-trivial task. In this paper, we propose a novel context-sensitive technique, called COSTER, to resolve FQNs of API elements in such code snippets. The proposed technique collects locally specific source code elements as well as globally related tokens as the context of FQNs, calculates likelihood scores, and builds an occurrence likelihood dictionary (OLD). Given an API element as a query, COSTER captures the context of the query API element, matches that with the FQNs of API elements stored in the OLD, and rank those matched FQNs leveraging three different scores: likelihood, context similarity, and name similarity scores. Evaluation with more than 600K code examples collected from GitHub and two different Stack Overflow datasets shows that our proposed technique improves precision by 4-6% and recall by 3-22% compared to state-of-the-art techniques. The proposed technique significantly reduces the training time compared to the StatType, a state-of-the-art technique, without sacrificing accuracy. Extensive analyses on results demonstrate the robustness of the proposed technique.",G19-130002,,10.1109/ase.2019.00032,Saifullah-2019-Learning
Large loss of CO2 in winter observed across the northern permafrost region,"Susan M. Natali, Jennifer D. Watts, Brendan M. Rogers, Stefano Potter, Sarah M. Ludwig, Anne-Katrin Selbmann, Patrick F. Sullivan, Benjamin W. Abbott, Kyle A. Arndt, Leah Birch, Mats P. Björkman, A. Anthony Bloom, Gerardo Celis, Torben R. Christensen, Casper T. Christiansen, Roisin Commane, Elisabeth J. Cooper, Patrick Crill, Claudia Czimczik, Sergey Davydov, Jinyang Du, Jocelyn E. Egan, Bo Elberling, Eugenie S. Euskirchen, Thomas Friborg, Hélène Genet, Mathias Göckede, Jordan P. Goodrich, Paul Grogan, Manuel Helbig, Elchin E. Jafarov, Julie D. Jastrow, Aram A. M. Kalhori, Yongwon Kim, John S. Kimball, Lars Kutzbach, Mark J. Lara, Klaus S. Larsen, Bang-Yong Lee, Zhihua Liu, Michael M. Loranty, Magnus Lund, Massimo Lupascu, Nima Madani, Avni Malhotra, Roser Matamala, Jack McFarland, A. David McGuire, Anders Michelsen, Christina Minions, Walter C. Oechel, David Olefeldt, Frans-Jan W. Parmentier, Norbert Pirk, Ben Poulter, William Quinton, Fereidoun Rezanezhad, David Risk, Torsten Sachs, Kevin Schaefer, Niels M. Schmidt, Edward A. G. Schuur, Philipp R. Semenchuk, Gaius Shaver, Oliver Sonnentag, Gregory Starr, Claire C. Treat, Mark P. Waldrop, Yihui Wang, Jeffrey Welker, Christian Wille, Xiaofeng Xu, Zhen Zhang, Qianlai Zhuang, Donatella Zona, ","Recent warming in the Arctic, which has been amplified during the winter1-3, greatly enhances microbial decomposition of soil organic matter and subsequent release of carbon dioxide (CO2)4. However, the amount of CO2 released in winter is highly uncertain and has not been well represented by ecosystem models or by empirically-based estimates5,6. Here we synthesize regional in situ observations of CO2 flux from arctic and boreal soils to assess current and future winter carbon losses from the northern permafrost domain. We estimate a contemporary loss of 1662 Tg C yr-1 from the permafrost region during the winter season (October through April). This loss is greater than the average growing season carbon uptake for this region estimated from process models (-1032 Tg C yr-1). Extending model predictions to warmer conditions in 2100 indicates that winter CO2 emissions will increase 17% under a moderate mitigation scenario-Representative Concentration Pathway (RCP) 4.5-and 41% under business-as-usual emissions scenario-RCP 8.5. Our results provide a new baseline for winter CO2 emissions from northern terrestrial regions and indicate that enhanced soil CO2 loss due to winter warming may offset growing season carbon uptake under future climatic conditions.",G19-131001,852-857,10.1038/s41558-019-0592-8,Natali-2019-Large
Controls on evapotranspiration from jack pine forests in the Boreal Plains Ecozone,"Mahtab Nazarbakhsh, Andrew M. Ireson, Alan G. Barr, ","The exchanges of water, energy and carbon between the land surface and the atmosphere are tightly coupled, so that errors in simulating evapotranspiration lead to errors in simulating both the water and carbon balances. Areas with seasonally frozen soils present a particular challenge due to the snowmelt‐dominated hydrology and the impact of soil freezing on the soil hydraulic properties and plant root water uptake. Land surface schemes that have been applied in high latitudes often have reported problems with simulating the snowpack and runoff. Models applied at the Boreal Ecosystem Research and Monitoring Sites in central Saskatchewan have consistently over‐predicted evapotranspiration as compared with flux tower estimates. We assessed the performance of two Canadian land surface schemes (CLASS and CLASS‐CTEM) for simulating point‐scale evapotranspiration at an instrumented jack pine sandy upland site in the southern edge of the boreal forest in Saskatchewan, Canada. Consistent with past reported results, these models over‐predicted evapotranspiration, as compared with flux tower observations, but only in the spring period. Looking systematically at soil properties and vegetation characteristics, we found that the dominant control on evapotranspiration within these models was the canopy conductance. However, the problem of excessive spring ET could not be solved satisfactorily by changing the soil or vegetation parameters. The model overestimation of spring ET coincided with the overestimation of spring soil liquid water content. Improved algorithms for the infiltration of snowmelt into frozen soils and plant‐water uptake during the snowmelt and soil thaw periods may be key to addressing the biases in spring ET.",G19-132001,927-940,10.1002/hyp.13674,Nazarbakhsh-2019-Controls
